mindformers,wangxiaoke,【CAAI】MindFormers中缺乏掩码语言模型的封装," 1.Describe the current behavior / 尝试手动封装掩码语言模型，但是在运行过程中遇到如下问题： Traceback (most recent call last):   File ""D:\KGC\project\yf\ATAP_code\atap\main.py"", line 567, in      main()   File ""D:\KGC\project\yf\ATAP_code\atap\main.py"", line 528, in main     _,relation_best_hit1,relation_best_hit3,relation_best_hit10,len_dataset,relation_best_mrr = trainer.train()   File ""D:\KGC\project\yf\ATAP_code\atap\main.py"", line 434, in train     test_loss, test_hit1, test_hit3, test_hit10, len_dataset, mrr = self.evaluate(epoch_idx, 'Test')   File ""D:\KGC\project\yf\ATAP_code\atap\main.py"", line 199, in evaluate     current_loss, current_hit1, current_hit3, current_hit10, current_mrr = self.model(   File ""C:\ProgramData\anaconda3\envs\InteractE\lib\sitepackages\mindspore\nn\cell.py"", line 720, in __call__     out = self.compile_and_run(*args, **kwargs)   File ""C:\ProgramData\anaconda3\envs\InteractE\lib\sitepackages\mindspore\nn\cell.py"", line 1138, in compile_and_run     self.compile(*args, **kwargs)   File ""C:\ProgramData\anaconda3\envs\InteractE\lib\sitepackages\mindspore\nn\cell.py"", line 1121, in compile     _cell_graph_executor.compile(self, *self._compile_args, phase=self.phase,   File ""C:\ProgramData\anaconda3\envs\InteractE\lib\sitepackages\mindspore\common\api.py"", line 1840, in compile     result = self._graph_executor.compile(obj, args, kwargs, phase, self._use_vm_mode()) TypeError:   Kernel select failed:  Select CPU operator[Gather] fail! Unsupported data type! The supported data types are input[UInt8 Int32 Int64 Int64], output[UInt8]; input[UInt16 Int32 Int64 Int64], output[UInt16]; input[UInt32 Int32 Int64 Int64], output[UInt32]; input[UInt64 Int32 Int64 Int64], output[UInt64]; input[Int8 Int32 Int64 Int64], output[Int8]; input[Int16 Int32 Int64 Int64], output[Int16]; input[Int32 Int32 Int64 Int64], output[Int32]; input[Int64 Int32 Int64 Int64], output[Int64]; input[Float16 Int32 Int64 Int64], output[Float16]; input[Float32 Int32 Int64 Int64], output[Float32]; input[Float64 Int32 Int64 Int64], output[Float64]; input[Bool Int32 Int64 Int64], output[Bool]; input[Complex64 Int32 Int64 Int64], output[Complex64]; input[Complex128 Int32 Int64 Int64], output[Complex128]; , but get input[Float32 Float32 Int64 Int64 ] and output[Float32 ]   The Function Call Stack: (For framework developers)  In file C:\ProgramData\anaconda3\envs\InteractE\lib\sitepackages\mindspore\nn\layer\embedding.py:155, 33~79/            output_for_reshape = self.gather(self.embedding_table, flat_ids, 0)/ In file C:\ProgramData\anaconda3\envs\InteractE\lib\sitepackages\mindspore\nn\layer\embedding.py:145~158, 4~21/    def construct(self, ids):/ In file D:\KGC\project\yf\ATAP_code\atap\p_tuning\modeling.py:63, 21~36/        raw_embeds = self.embeddings(queries_for_embedding)/ In file D:\KGC\project\yf\ATAP_code\atap\p_tuning\modeling.py:55~81, 4~25/    def embed_input(self, queries):/ In file D:\KGC\project\yf\ATAP_code\atap\p_tuning\modeling.py:169, 24~40/        inputs_embeds = self.embed_input(padded_queries)/ In file D:\KGC\project\yf\ATAP_code\atap\p_tuning\modeling.py:139~246, 4~39/    def construct(self, token_ids, x_hs, x_ts, evaluate_type, epoch, return_candidates=False):/ node: :output_for_reshape{[0]: ValueNode PrimFunc_Gather, [1]: :CNode_87{[0]: ValueNode Load, [1]: param_embeddings.embedding_table, [2]: ValueNode U}, [2]: :flat_ids{[0]: ValueNode PrimFunc_Reshape, [1]: CNode_88, [2]: ValueNode (1)}, [3]: ValueNode 0, [4]: ValueNode 0}   C++ Call Stack: (For framework developers)  mindspore\ccsrc\plugin\device\cpu\hal\hardware\cpu_device_context.cc:517 mindspore::device::cpu::CPUKernelExecutor::SetOperatorInfo",2025-05-08T18:27:07+08:00,,open,0,0,https://gitee.com/mindspore/mindspore/issues/IC6E9Q
overflow,majun-bot,CVE20223786,"一、漏洞信息 漏洞编号：CVE20223786 漏洞归属组件：openssl, https://gitee.com/mindspore/mindspore 漏洞归属的版本：1.1.1k CVSS分值： &emsp;BaseScore： N/A None &emsp;Vector： N/A 漏洞简述： A buffer overrun can be triggered in X.509 certificate verification, specifically in name constraint checking. Note that this occurs after certificate chain signature verification and requires either a CA to have signed a malicious certificate or for an application to continue certificate verification despite failure to construct a path to a trusted issuer. An attacker can craft a malicious email address in a certificate to overflow an arbitrary number of bytes containing the `.' character (decimal 46) on the stack. This buffer overflow could result in a crash (causing a denial of service). In a TLS client, this can be triggered by connecting to a malicious server. In a TLS server, this can be triggered if the server requests client authentication and a malicious client connects. 漏洞公开时间：20221102 02:15:11 漏洞创建时间：20250506 01:45:35 漏洞详情参考链接： https://nvd.nist.gov/vuln/detail/CVE20223786 漏洞分析指导链接： https://gitee.com/mindspore/community/blob/master/security/cve_issue_template.md 漏洞补丁信息：  详情(点击展开)   二、漏洞分析结构反馈 影响性分析说明： 漏洞评分(MindSpore评分): &emsp;BaseScore：  &emsp;Vector：  受影响版本排查(受影响/不受影响)： 1.master: 2.r1.10: 3.r1.9: 4.r2.0: 5.r2.1: 6.r2.2: 7.r2.3:",2025-05-06T01:45:36+08:00,"CVE/UNFIXED,gitee",open,0,2,https://gitee.com/mindspore/mindspore/issues/IC5J94,"**issue处理注意事项:**  **1. 当前issue受影响的分支提交pr时, 须在pr描述中填写当前issue编号进行关联, 否则无法关闭当前issue;** **2. 模板内容需要填写完整, 无论是受影响或者不受影响都需要填写完整内容,未引入的分支不需要填写, 否则无法关闭当前issue;** **3. 以下为模板中需要填写完整的内容, 请复制到评论区回复, 注: 内容的标题名称(影响性分析说明, MindSpore评分, 受影响版本排查(受影响/不受影响))不能省略,省略后cvemanager将无法正常解析填写内容.** ************************************************************************ 影响性分析说明:  漏洞评分(mindspore评分): BaseScore: x.x(浮点格式) Vector: 受影响版本排查(受影响/不受影响):  1.master: 2.r1.10: 3.r1.9: 4.r2.0: 5.r2.1: 6.r2.2: 7.r2.3:  pr关联issue具体操作请参考: https://gitee.com/help/articles/4142",【回归指南】 请参考以下典型优秀案例进行问题单根因分析，如未按此模板进行根因分析，转回归会被打回，更多问题单规范请参看https://e.gitee.com/mind_spore/docs/2489468/file/5767947?sub_id=11382313&scope=undefined > Appearance & Root Cause > 问题：pangu_sigma2.3编译耗时优化未达预期 > 根因： > 1、 2.3上某些pass相比于2.2版本的实现，存在性能劣化 > 2、 2.3版本把trace功能下掉了，导致前端编译劣化 >  > Fix Solution > 1、修复性能劣化的前端图优化pass > 2、通过支持boost infer功能把trace功能下掉导致的性能劣化拿回来 >  > Fix Description & Test Suggestion > https://gitee.com/mindspore/mindspore/pulls/70920 PR合入后daily包回归 > 测试建议：该问题可以通过特性用例防护，增加****场景。 >  > Selftest Report & DT Review > 目前前后端耗时在12分钟以内。 > 是否需要补充 ST/UT：否 如果选择否，请补充理由 > 原因：非基本功能问题 >  > Introduction Analysis > 引入类型：特性合入引入 / Bugfix修复引入 / 测试新增测试场景 / 测试漏测 / 用例未适配 / 环境问题 / CANN升级 > 引入PR：https://e.gitee.com/mind_spore/repos/mindspore/mindspore/pulls/xxx > PR合入时间：年/月/日 > 问题是否偶现：是/否
yi,majun-bot,CVE20232650,"一、漏洞信息 漏洞编号：CVE20232650 漏洞归属组件：openssl, https://gitee.com/mindspore/mindspore 漏洞归属的版本：1.1.1k CVSS分值： &emsp;BaseScore： 6.5 Medium &emsp;Vector： CVSS:3.1/AV:N/AC:L/PR:N/UI:R/S:U/C:N/I:N/A:H 漏洞简述： Issue summary: Processing some specially crafted ASN.1 object identifiers or data containing them may be very slow. Impact summary: Applications that use OBJ_obj2txt() directly, or use any of the OpenSSL subsystems OCSP, PKCS7/SMIME, CMS, CMP/CRMF or TS with no message size limit may experience notable to very long delays when processing those messages, which may lead to a Denial of Service. An OBJECT IDENTIFIER is composed of a series of numbers  subidentifiers  most of which have no size limit.  OBJ_obj2txt() may be used to translate an ASN.1 OBJECT IDENTIFIER given in DER encoding form (using the OpenSSL type ASN1_OBJECT) to its canonical numeric text form, which are the subidentifiers of the OBJECT IDENTIFIER in decimal form, separated by periods. When one of the subidentifiers in the OBJECT IDENTIFIER is very large (these are sizes that are seen as absurdly large, taking up tens or hundreds of KiBs), the translation to a decimal number in text may take a very long time.  The time complexity is O(n^2) with 'n' being the size of the subidentifiers in bytes (*). With OpenSSL 3.0, support to fetch cryptographic algorithms using names / identifiers in string form was introduced.  This includes using OBJECT IDENTIFIERs in canonical numeric text form as identifiers for fetching algorithms. Such OBJECT IDENTIFIERs may be received through the ASN.1 structure AlgorithmIdentifier, which is commonly used in multiple protocols to specify what cryptographic algorithm should be used to sign or verify, encrypt or decrypt, or digest passed data. Applications that call OBJ_obj2txt() directly with untrusted data are affected, with any version of OpenSSL.  If the use is for the mere purpose of display, the severity is considered low. In OpenSSL 3.0 and newer, this affects the subsystems OCSP, PKCS7/SMIME, CMS, CMP/CRMF or TS.  It also impacts anything that processes X.509 certificates, including simple things like verifying its signature. The impact on TLS is relatively low, because all versions of OpenSSL have a 100KiB limit on the peer's certificate chain.  Additionally, this only impacts clients, or servers that have explicitly enabled client authentication. In OpenSSL 1.1.1 and 1.0.2, this only affects displaying diverse objects, such as X.509 certificates.  This is assumed to not happen in such a way that it would cause a Denial of Service, so these versions are considered not affected by this issue in such a way that it would be cause for concern, and the severity is therefore considered low. 漏洞公开时间：20230530 22:15:09 漏洞创建时间：20250503 00:24:58 漏洞详情参考链接： https://nvd.nist.gov/vuln/detail/CVE20232650 漏洞分析指导链接： https://gitee.com/mindspore/community/blob/master/security/cve_issue_template.md 漏洞补丁信息：  详情(点击展开)   二、漏洞分析结构反馈 影响性分析说明： 漏洞评分(MindSpore评分): &emsp;BaseScore：  &emsp;Vector：  受影响版本排查(受影响/不受影响)： 1.master: 2.r1.10: 3.r1.9: 4.r2.0: 5.r2.1: 6.r2.2: 7.r2.3:",2025-05-03T00:24:58+08:00,"CVE/UNFIXED,gitee",open,0,2,https://gitee.com/mindspore/mindspore/issues/IC5DBO,"**issue处理注意事项:**  **1. 当前issue受影响的分支提交pr时, 须在pr描述中填写当前issue编号进行关联, 否则无法关闭当前issue;** **2. 模板内容需要填写完整, 无论是受影响或者不受影响都需要填写完整内容,未引入的分支不需要填写, 否则无法关闭当前issue;** **3. 以下为模板中需要填写完整的内容, 请复制到评论区回复, 注: 内容的标题名称(影响性分析说明, MindSpore评分, 受影响版本排查(受影响/不受影响))不能省略,省略后cvemanager将无法正常解析填写内容.** ************************************************************************ 影响性分析说明:  漏洞评分(mindspore评分): BaseScore: x.x(浮点格式) Vector: 受影响版本排查(受影响/不受影响):  1.master: 2.r1.10: 3.r1.9: 4.r2.0: 5.r2.1: 6.r2.2: 7.r2.3:  pr关联issue具体操作请参考: https://gitee.com/help/articles/4142",【回归指南】 请参考以下典型优秀案例进行问题单根因分析，如未按此模板进行根因分析，转回归会被打回，更多问题单规范请参看https://e.gitee.com/mind_spore/docs/2489468/file/5767947?sub_id=11382313&scope=undefined > Appearance & Root Cause > 问题：pangu_sigma2.3编译耗时优化未达预期 > 根因： > 1、 2.3上某些pass相比于2.2版本的实现，存在性能劣化 > 2、 2.3版本把trace功能下掉了，导致前端编译劣化 >  > Fix Solution > 1、修复性能劣化的前端图优化pass > 2、通过支持boost infer功能把trace功能下掉导致的性能劣化拿回来 >  > Fix Description & Test Suggestion > https://gitee.com/mindspore/mindspore/pulls/70920 PR合入后daily包回归 > 测试建议：该问题可以通过特性用例防护，增加****场景。 >  > Selftest Report & DT Review > 目前前后端耗时在12分钟以内。 > 是否需要补充 ST/UT：否 如果选择否，请补充理由 > 原因：非基本功能问题 >  > Introduction Analysis > 引入类型：特性合入引入 / Bugfix修复引入 / 测试新增测试场景 / 测试漏测 / 用例未适配 / 环境问题 / CANN升级 > 引入PR：https://e.gitee.com/mind_spore/repos/mindspore/mindspore/pulls/xxx > PR合入时间：年/月/日 > 问题是否偶现：是/否
ascend,hbhdlxx08,权重量化转化工具转换操作，无法找到 hool.json 文件,"1.问题现象截图： !输入图片说明 !输入图片说明 2.操作指引： bash convert_quant_weight.sh src /data/QwQ32B/ dst /data/QwQ32Bw8a8/ type qwen_w8a8 3.硬件信息：910B1 https://gitee.com/ascend/msit/tree/master/msmodelslim 量化操作 4.详细报错 FileNotFoundError: The file is expected to exist, but it does not.   Please check the input path: /usr/local/Ascent/atbmodels/examples/models/gwenn/examples/convert/model_slim/hool.json",2025-04-28T19:54:00+08:00,"www,gitee",open,0,1,https://gitee.com/mindspore/mindspore/issues/IC4QG6,hool.json文件？是不是应该hccl.json? 看你提供的那个码云链接，这里的量化转换好像不是mindspore框架这边的，是用了昇腾直接提供的一些工具，昇腾工具的相关问题可以直接去昇腾论坛的cann板块提问： https://www.hiascend.com/forum/forum01061013859211750041.html?filterCondition=1&topicClassId=0607101389987648003 或者如果用了上面码云仓库的相关工具，可以直接在上述码云仓库的issue里提问： https://gitee.com/ascend/msit/tree/master/msmodelslim 那边应该有专门负责这块的研发团队来解答问题
ascend,zhangyinxia,tcp_store接口设置key在1G左右会core,"   Describe the current behavior / 问题描述 (Mandatory / 必填) tcp_store接口设置key在1G左右会core ` def test_tcp_store_004():     this_rank = get_rank()     store = TCPStore()     if this_rank == 0:         store.set('A' * 1024 * 1024 * 1024, 'B' * 1024 * 1024 * 1024)     barrier()     out_get_key_3 = store.get('A' * 1024 * 1024 * 1024)     assert out_get_key_3 == b'B' * 1024 * 1024 * 1024 `  Environment / 环境信息 (Mandatory / 必填)  **Hardware Environment(`Ascend`/`GPU`/`CPU`)  / 硬件环境**:  > Please delete the backend not involved / 请删除不涉及的后端: > /device ascend/GPU/CPU/kirin/等其他芯片  **Software Environment / 软件环境 (Mandatory / 必填)**:  MindSpore version (e.g., 1.7.0.Bxxx) :  Python version (e.g., Python 3.7.5) :  OS platform and distribution (e.g., Linux Ubuntu 16.04):  GCC/Compiler version (if compiled from source):   **Excute Mode / 执行模式 (Mandatory / 必填)(`PyNative`/`Graph`)**:  > Please delete the mode not involved / 请删除不涉及的模式: > /mode pynative > /mode graph  Related testcase / 关联用例 (Mandatory / 必填)  Steps to reproduce the issue / 重现步骤 (Mandatory / 必填) 1.  2.   3.   Describe the expected behavior / 预期结果 (Mandatory / 必填)  Related log / screenshot / 日志 / 截图 (Mandatory / 必填)  Special notes for this issue/备注 (Optional / 选填)",2025-04-27T15:55:06+08:00,,open,0,0,https://gitee.com/mindspore/mindspore/issues/IC4DB3
mindformers,hbhdlxx08,mindie跑GLM4ms一直显示The meta server node can not be finalized because there are still 2 alive nodes.,1.问题现象截图： !输入图片说明 执行bash run_mindie.sh modelname GLMZ132B0414 modelpath /data/GLMZ132B0414 maxprefillbatchsize 4会出现该现象 2.操作指引： https://mp.weixin.qq.com/s/VBrsu6r3GM8nxMe5XK93YA 3.硬件信息：910B1 4.docker镜像：swr.cncentral221.ovaijisuan.com/mindformers/mindspore_glm_z1:20250414,2025-04-27T14:56:40+08:00,,open,0,1,https://gitee.com/mindspore/mindspore/issues/IC4C86,可能是进程没杀干净，请清空缓存再试
