transformer,Scaled Dot-Product Attention Invalid Configuration Error on Large batch size," Scaled DotProduct Attention Invalid Configuration Error on Large batch size  Summary The `torch.nn.functional.scaled_dot_product_attention` (sdpa) function is not working as expected when the batch size is large. It causes a `RuntimeError: CUDA error: invalid configuration argument`. This problem affects also the `torch.nn.TransformerEncoderLayer` as it relies on the `scaled_dot_product_attention` function.  Reproducing the error The following scripts are run with:  However, the same results can be obtained without setting `CUDA_LAUNCH_BLOCKING=1`.  SDPA Example This code will raise the error:    TransformerEncoderLayer Example This code will raise the error:    Cause of The Error I searched a little bit for the cause of the error. Here is what I found: The error is caused in file `pytorch/aten/src/ATen/native/transformers/cuda/attention.cu`. In particular the `launchKernel` lambda inside `_efficient_attention_forward` is responsible for the error. To my understanding this is the code snippet that triggers the invalid configuration:  It appears that, with a large batch size this kernel is run with a number of blocks that exceeds the maximum number of kernel blocks, `65,535`. This triggers the invalid configuration error. As a matter of fact, running the snippet  will not raise the error. Doing the same with a batch size of `65536` will raise the error. Note that also the number of heads contributes to the number of cuda blocks. So also an increased number of heads will trigger the error.   SDPA Workaround The error can be avoided by simply removing the number of heads dimension in the input tensor. For example,  Note that, the pytorch d",2024-12-06T10:54:13Z,,open,0,0,https://github.com/pytorch/pytorch/issues/142228
transformer,torch.export.export fails to export a model with dynamic shapes for a custom type, 🐛 Describe the bug torch.export.export fails to keep a dynamic dimension. The script is using a custom class. Is it a bug or did I forget something when I registed the custom class?   Versions ,2024-12-05T19:27:45Z,,open,0,0,https://github.com/pytorch/pytorch/issues/142161
transformer,[export] NotImplementedError: No registered serialization name for <class 'diffusers.models.modeling_outputs.Transformer2DModelOutput'>, 🐛 Describe the bug Flux model has been compiled using TorchTensorRT and I'm trying to export it using `torch.export.export` and see the following error   Here's the full script to reproduce the error   cc:    Versions torch.version '2.6.0.dev20241202+cu124' trt.version '10.6.0.post1' ,2024-12-04T01:54:18Z,oncall: pt2 oncall: export,open,0,2,https://github.com/pytorch/pytorch/issues/142025,"We need to go here and update their code to also include the serialized type name, similar to what I did here",Thanks  that got me forward and now it results in the  CC([export] Saving models over 4GiB requires pickle protocol 4 or higher ). Any suggestions on this ? 
transformer,[export] Saving models over 4GiB requires pickle protocol 4 or higher ," 🐛 Describe the bug For large models compiled with TorchTensorRT, when we try to save them we get an error as follows   Two models have this issue flux schnell and laion2b_s34b_b82k_augreg_soup  from open_clip Is there a way to pass the pickle protocol to torch.export.save similar to torch.save ?  cc:   Here's a script to reproduce the flux error    Versions  torch.__version__ '2.6.0.dev20241202+cu124'  trt.__version__ '10.6.0.post1' ",2024-12-03T22:08:24Z,oncall: pt2 oncall: export,open,0,2,https://github.com/pytorch/pytorch/issues/142004, Any updates on this issue ?, See https://github.com/pytorch/pytorch/pull/142253
transformer,Forward from pytorch/executorch: export error with Macbook pro M4 ," 🐛 Describe the bug Original Issue: https://github.com/pytorch/executorch/issues/7127  when I export .pte from Llama3.2 1B, it is enterrupt. the error is blow: python m examples.models.llama.export_llama checkpoint ""/Users/qitmac001443/.llama/checkpoints/Llama3.18B/consolidated.00.pth"" params ""/Users/qitmac001443/.llama/checkpoints/Llama3.18B/params.json"" kv use_sdpa_with_kv_cache X d bf16 metadata '{""get_bos_id"":128000, ""get_eos_ids"":[128009, 128001]}' output_name=""llama3_1.pte"" INFO:root:Applying quantizers: [] INFO:root:Loading model with checkpoint=/Users/qitmac001443/.llama/checkpoints/Llama3.18B/consolidated.00.pth, params=/Users/qitmac001443/.llama/checkpoints/Llama3.18B/params.json, use_kv_cache=True, weight_type=WeightType.LLAMA INFO:root:model.to torch.bfloat16 INFO:root:Loading custom ops library: /Users/qitmac001443/Desktop/workspace/executorch/.venv/lib/python3.12/sitepackages/executorch/extension/llm/custom_ops/libcustom_ops_aot_lib.dylib INFO:root:Model after source transforms: Transformer( (tok_embeddings): Embedding(128256, 4096) (layers): ModuleList( (031): 32 x TransformerBlock( (attention): Attention( (wq): Linear(in_features=4096, out_features=4096, bias=False) (wk): Linear(in_features=4096, out_features=1024, bias=False) (wv): Linear(in_features=4096, out_features=1024, bias=False) (wo): Linear(in_features=4096, out_features=4096, bias=False) (kv_cache): KVCache() (SDPA): SDPA( (kv_cache): KVCache() ) (apply_rotary_emb): RotaryEmbedding() ) (feed_forward): FeedForward( (w1): Linear(in_features=4096, out_features=14336, bias=False) (w2): Linear(in_features=14336, out_features=4096, bias=False) (w3): Linear(in_feature",2024-12-02T18:30:55Z,oncall: export,open,0,4,https://github.com/pytorch/pytorch/issues/141893,Forwarded here as Pytorch compiler asked me to do this if we got user export issues in executorch repo. ,Feels like it belongs in ET,Could they try using nonstrict?,"And providing the TORCH_LOGS=""+export"" with the original code? "
transformer,Can not convert Llama-3.2-11B-Vision-Instruct by torch.jit.script / torch.jit.trace," 🐛 Describe the bug I am trying to convert the `*.pth` file to `*.pt` file for using libtorch to load the model in C++. But both `torch.jit.script` or `torch.jit.trace` will emit a not support type error. I encountered this error, but I'm not sure if I misused the function, if it's an unimplemented feature, or if it's an upstream issue. Thank you for your guidance.    Versions  ",2024-12-02T08:35:22Z,oncall: jit,open,0,0,https://github.com/pytorch/pytorch/issues/141855
transformer,running my facebook/bart-base for summarization task :  MPS does not support cumsum op with int64 input," 🐛 Describe the bug ''' Summarization implementation ''' from domain.interfaces import SummarizationServiceInterface from transformers import AutoTokenizer, AutoModelForSeq2SeqLM import torch class SummarizationService(SummarizationServiceInterface):     """"""Summarizes text using a pretrained model.""""""     def __init__(self, model_name: str = ""facebook/bartbase"", device: str = ""mps""):         """"""         Initializes the summarization service.         Args:             model_name (str): Name of the pretrained model to load.             device (str): Device to run the model on ('cpu' or 'mps').         """"""         self.device = torch.device(device)         self.tokenizer = AutoTokenizer.from_pretrained(model_name)         self.model = AutoModelForSeq2SeqLM.from_pretrained(model_name).to(self.device)     def summarize(self, texts: list[str]) > str:         """"""         Summarizes a list of texts.         Args:             texts (list[str]): A list of text to summarize.         Returns:             str: The summarized text.         """"""         combined_text = "" "".join(texts)         inputs = self.tokenizer(             combined_text, max_length=1024, return_tensors=""pt"", truncation=True         ).to(self.device)         summary_ids = self.model.generate(             inputs[""input_ids""], max_length=150, min_length=40, num_beams=1, early_stopping=True         )         return self.tokenizer.decode(summary_ids[0], skip_special_tokens=True)         The error message is:         Summarizing Cluster 231 with 153 reviews... /Users/..../Code/clustersummreviews/venv/lib/python3.9/sitepackages/transformers/generation/configuration_utils.py:638: UserWarn",2024-11-29T01:13:41Z,triaged module: mps,open,0,1,https://github.com/pytorch/pytorch/issues/141786,"This is likely not a problem with PyTorch itself, as downstream is trying to use `cumsum` with `torch.int64`, which is not supported with the MPS backend. If the error originates in hugging face code I can contrib a fix in their code base. Can you please provide a minimal reproduction example that can be run topdown to get the same error that you got?  label ""module: mps"""
transformer,Lint: switch oncall owner for test_transformers,  CC(Lint: switch oncall owner for test_transformers),2024-11-27T21:09:28Z,Merged topic: not user facing,closed,0,2,https://github.com/pytorch/pytorch/issues/141722," merge f ""Lint is green"""," Merge started Your change will be merged immediately since you used the force (f) flag, **bypassing any CI checks** (ETA: 15 minutes).  Please use `f` as last resort and instead consider `i/ignorecurrent` to continue the merge ignoring current failures.  This will allow currently pending tests to finish and report signal before the merge. Learn more about merging in the wiki. Questions? Feedback? Please reach out to the PyTorch DevX TeamAdvanced Debugging Check the merge workflow status  here "
transformer,xpu: running Huggingface hiera with initializer_range=1e-10 renders Nan output,"With: * PyTorch: https://github.com/pytorch/pytorch/commit/f2d388eddd25b5ab5b909a8b4cbf20ff34c6f3f2 * https://github.com/intel/torchxpuops/commit/15f6d654685a98b6bbf6b76ee094258b16dd21ca * https://github.com/huggingface/transformers/commit/1f6b423f0ce0c6e7afd300b59e5fd1a816e4896c * https://github.com/huggingface/accelerate/commit/e11d3ceff3a49378796cdff5b466586d877d5c60 Running Huggingface `hiera` model with nondefault `initializer_range=1e10` (default is `0.02` and it works) on Pytorch XPU backend (I used Intel PVC platform) fails  output tensor contains `Nan` values. This behavior was first found running the following Huggingface Transformer tests for `hiera` model:  Instead of running Huggingface Transformers, it's possible to reproduce the issue on the following script which is my attempt to extract essential behavior from HF test:  Issue appears when `initializer_range=1e10`. That's what HF Transformers are doing in the tests (see tests/test_modeling_common.pyL149). Output on XPU will be:  And running with default `initializer_range=0,02` on XPU you will get reasonable results (named HF hiera tests will pass with this value, but other tests form hiera will start to fail):  **Note that CUDA does handle `initializer_range=1e10` in a different way** and does not return `Nan` tensors. However, what CUDA returns is suspiciously ""good"":  And for complete picture on CUDA, that's what it returns on `initializer_range=0,02`:  CC:        ",2024-11-27T01:27:25Z,triaged module: xpu,open,0,8,https://github.com/pytorch/pytorch/issues/141642,"My guesses for the issue: 1. XPU backend calculates somewhere with the lower precision than CUDA 1. CUDA has different handling for corner cases when calculations step into precision limits Considering that CUDA did return too good results for `initializer_range=1e10`, I think that 2nd variant might be the case.",deng is looking into this issue. ,Registering a hook to dump outputs from each layer:  First time `inf/nan` appear on one of the `LayerNorm` layers. After that they waterfall in calculations in the following layers. Below output is output of layers from the very first till the `LayerNorm` where `inf/nan` appear: ,"Ok, so this seems to be an issue with XPU implementation of `LayerNorm`. Slightly modifying the hook to dump layer outputs, it's easy to dump an input of the first `LayerNorm` which has nan/inf values. I did that on my side and uploaded captured input here: https://github.com/dvrogozh/pytorch/blob/for_141642/PT_141642.pt. After that using the following script you can reproduce the issue:  Output will be:  And modifying `device` in the script to be `cpu`, you will get:  So, outputs for LayerNorm operation are different between cpu and xpu with xpu having nan/inf in some values (not in all values).","> My guesses for the issue: >  > 1. XPU backend calculates somewhere with the lower precision than CUDA > 2. CUDA has different handling for corner cases when calculations step into precision limits >  > Considering that CUDA did return too good results for `initializer_range=1e10`, I think that 2nd variant might be the case. As for 1: Current implementation for Layernorm in XPU is on the top of the onepass algorithm instead of Welford algorithm, which may lead some precision drop.","Sync with  , we will try to implement the Welford algorithm and then check if it can help. Besides, For  's guess 2, we will check the implementation for precision handling in this case.  ","Thank you, deng, !  Do we know which algorithm is implemented for CPU and CUDA? Welford? Can we just convert CUDA kernel to SYCL kernel to get the implementation?","> Thank you, deng, ! >  > Do we know which algorithm is implemented for CPU and CUDA? Welford? >  > Can we just convert CUDA kernel to SYCL kernel to get the implementation? Welford is the common solution and our changes are currently in progress"
transformer,xpu: implement aten::_thnn_fused_lstm_cell for XPU backend,"The following aten operator is not currently implemented for XPU backend and does not allow fallback with `PYTORCH_ENABLE_XPU_FALLBACK=1`:  [ ] `aten::_thnn_fused_lstm_cell`, https://github.com/intel/torchxpuops/pull/926 With: * https://github.com/huggingface/transformers/commit/bdb29ff9f3b8030772bd4be037d061f253c0e928 * https://github.com/huggingface/accelerate/commit/e11d3ceff3a49378796cdff5b466586d877d5c60 * https://github.com/pytorch/pytorch/commit/f2d388eddd25b5ab5b909a8b4cbf20ff34c6f3f2 Can be reproduced running Huggingface Transformers `encodec` model tests:  Unfortunately that's one of those aten operators for which running with `PYTORCH_ENABLE_XPU_FALLBACK=1` does not help. If ran with it getting this error:  CC:      ",2024-11-26T02:25:49Z,triaged module: xpu,open,0,1,https://github.com/pytorch/pytorch/issues/141539,Related PR: https://github.com/intel/torchxpuops/pull/926
transformer,[export] A node has no users in the exported program," 🐛 Describe the bug The following example produces a node with no user.  The graph contains the following line:  Version of 11/17 works, version of 11/21 fails.  Versions  ",2024-11-22T19:57:00Z,oncall: pt2 oncall: export,closed,0,6,https://github.com/pytorch/pytorch/issues/141373,"Removing the assert, the code runs for me with no errors. I had to change the call line ",But it does seem like `copy_` was no longer used.,"I took some time to investigate more, the line at stake is this one https://github.com/huggingface/transformers/blob/main/src/transformers/models/mistral/modeling_mistral.pyL978. !image When I compare the two graphs, I see a dead end for this specific line. ","Here is another example not using transformers. The exported program returns ``clone`` when it should return ``copy_``. However, its execution returns the correct result but it is unexpected. ",The graph produces by 11/17 version is using slice_scatter. ,I'll close this issue. It seems the default behaviour for setitem is not to decompose it into slice_scatter anymore.
transformer,Updating from torch 2.0 to 2.1/2.2/2.3/2.4/2.5 results in gradient explosion with SDPA and bf16 ," 🐛 Describe the bug We are training a huggingface transformer using pytorch native SDPA and the huggingface Trainer. We recently upgraded from torch 2.0, and found that **this change alone** caused our training runs to diverge.  We cannot upload any images and unfortunately are unable to share code since it is internal/proprietary. The training loss is almost identical across torch versions for over half the run and then they diverge. The diverges look similar to this issue  CC(CUDNN sdp attention causes loss explosion), however grad_norm can sometimes get up to values near 100. Here are some comparisons before and after different changes (all with grad clipping and max grad norm of 1.0): Torch 2.0 + bf16 + SDPA + lr=5e5 + gradient accum = 2> clean loss curve :white_check_mark: Torch **2.1/2.2/2.3/2.4/2.5** + bf16 + SDPA + lr=5e5 +  gradient accum = 2 > exploding gradients :x: Torch 2.4 + bf16 + SDPA + lr=5e5 + **gradient accum = 1** >  exploding gradients :x: Torch 2.4 +  **fp16** + SDPA + lr=5e5 + gradient accum = 2 > clean loss curve :white_check_mark: Torch 2.5 +  fp16 + SDPA + **lr=1e4** + gradient accum = 2 >exploding gradients :x: Torch 2.4 + bf16 + No SPDA (eager) + lr=5e5 + gradient accum = 2 > clean loss curve :white_check_mark:  We also tried what this issue) reported as a solution (`torch.backends.cuda.enable_cudnn_sdp(False)`) but this also resulted in exploding gradients. We are unsure whether this is an issue with SDPA after 2.0 or just finicky pretraining. Is there anything that changed post torch 2.0 that could be related to this issue? Seems odd that upgrading torch alone would cause this shift in behavior. Any help wou",2024-11-21T14:59:59Z,triaged module: sdpa,open,2,0,https://github.com/pytorch/pytorch/issues/141241
transformer,`CrossEntropyLoss` much slower with class probabilities vs. class indices target," 🐛 Describe the bug Hi, I noticed this when training ViTS/16 on the ImageNet1k dataset, with and without MixUp. In short: torchvision's `v2.MixUp`, just like other common implementations, converts the class indices to onehot class probabilities before linearly interpolate them, so the same call to `CrossEntropyLoss()` goes to different kernels with vs. without MixUp. In a less optimized setting (specific commit), I found that with vs. without MixUp makes the difference between **0.198s vs. 0.120s** per step (excluding data loading) with batch size 1024 on a 8x A100SXM440GB Lambda instance. In further iterations, I included `CrossEntropyLoss` in the model so they compile together. I then tested a workaround in which the custom MixUp returns both targets and the weight scalar lam(bda):  and the model calculates the cross entropy loss by using the class indices twice:  See https://github.com/EIFY/mupvit/compare/normalprefetch...lossoptim. I found that this is faster (**0.184s** per step) than just calling `CrossEntropyLoss()` with class probabilities even with `torch.compile(...,mode=""maxautotunenocudagraphs"")` (**0.191s** per step), excluding data loading. Is this expected? Intuitively I can see that the sparsity helps forward & backward pass in loss calculation, but backward pass beyond that should be the same and it's hard to understand the observed second/step difference with a 12layer transformer. To replicate the timing result, you can run the code with fake data:  with either the normalprefetch or the lossoptim branch.  Versions The output below shows PyTorch version: 2.3.1 and torchvision==0.18.1, but I am actually running  I don't ",2024-11-20T22:32:58Z,module: nn module: loss triaged,open,1,0,https://github.com/pytorch/pytorch/issues/141177
transformer,"Cannot view a tensor with shape torch.Size([2, 1, 8, 32]) and strides (32, 512, 64, 1) as a tensor with shape (2, 256)! for transfomer MHA with permute, view"," 🐛 Describe the bug When exporting my transformer model with torch.onnx.export(... dynamo=True, ...), any sequence length >= 2 gives the error. Sequence length 1 works but does not support dynamic shapes in inference. When dynamic_shapes is off, I get the above error, and when dynamic_shapes is set and seq_len >=2, I get an error about guard lengths similar to CC(torch.export.export() fails with dynamic shapes when more than one shape is dynamic). I tried latest nightly (9 PM PST on 11/19) but didn't work. Also noticed this issue is similar to CC([export] Cannot view a tensor with shape torch.Size([1, 512, 32, 128]) and strides (2097152, 128, 65536, 1) as a tensor with shape (1, 512, 4096)) and CC([export] `run_decomposition` fails for permute>view sequence). Thanks in advance for the help! onnx_export_20241119_210853216442_conversion.md **Repro**   Versions Collecting environment information... PyTorch version: 2.6.0.dev20241112+cu124 Is debug build: False CUDA used to build PyTorch: 12.4 ROCM used to build PyTorch: N/A OS: Ubuntu 24.04.1 LTS (x86_64) GCC version: (Ubuntu 13.2.023ubuntu4) 13.2.0 Clang version: Could not collect CMake version: Could not collect Libc version: glibc2.39 Python version: 3.12.3 (main, Sep 11 2024, 14:17:37) [GCC 13.2.0] (64bit runtime) Python platform: Linux5.15.153.1microsoftstandardWSL2x86_64withglibc2.39 Is CUDA available: True CUDA runtime version: Could not collect CUDA_MODULE_LOADING set to: LAZY GPU models and configuration: GPU 0: NVIDIA GeForce RTX 4070 Laptop GPU Nvidia driver version: 560.94 cuDNN version: Could not collect HIP runtime version: N/A MIOpen runtime version: N/A Is XNNPACK available:",2024-11-20T05:16:40Z,needs reproduction module: onnx oncall: pt2 oncall: export,open,1,2,https://github.com/pytorch/pytorch/issues/141107, I think you may use this as a repro,
transformer,graph break when training LoRA," 🐛 Describe the bug In torchtune, we offer LoRA training, which consists of freezing transformer layers and adding just a few matrices that are trainable. In this setting,  the input to the first transformer doesnt require gradients. However, the intput to the second transformer does. You can see the loop here. We compile each transformer block independently, to avoid long compilation times. Because of that, i get a graph break:   Is there a mark_dynamic equivalent for required_grad? tlparse: https://interncacheall.fbcdn.net/manifold/tlparse_reports/tree/logs/.tmptwNd6e/index.html To reproduce:    Error logs _No response_  Versions Tried it with both: 2.5.1 and 2.6.0.dev20241119+cu124 ",2024-11-19T16:34:06Z,oncall: pt2,closed,0,2,https://github.com/pytorch/pytorch/issues/141039,"Oh  the recompile is because: (1) you are compiling two individual layers (2) on the first layer, your input `x` does not require_grad, and so we don't need to compute gradients for it (3) on the second layer, the input to that layer is an activation, which we **do** need to compute gradients for. We need to recompile for the first layer vs the second, because we need to do less compute in the backward of the first layer. This should cause at most one recompile though  is that a problem for you? Altenratively, you could try compiling both layers together into a single graph to avoid the recompiles","not really a problem, just figuring out ways to improve it. If there isnt an easy flag, then thats ok. Thank you for taking a look!"
transformer,xpu: implement aten::_linalg_eigvals for XPU backend (affecting HF Transformers v4.46.0 and later),"Recent changes in Huggingface Transformers (https://github.com/huggingface/transformers/commit/cdee5285cade176631f4f2ed3193a0ff57132d8b and https://github.com/huggingface/transformers/commit/4a3f1a686fcda27efc19b8b3a87b62a338c2ad86) introduced usage of `torch.linalg.eigvals()` which is not implemented for XPU backend (missing `aten::_linalg_eigvals`) and it's not registered for automated CPU fallback as well. To use this operator with XPU you need to use `PYTORCH_ENABLE_XPU_FALLBACK=1`. Transformers version v4.46.0 and later are affected. Can this operator, please, be added?  [ ] `aten::_linalg_eigvals` With: * https://github.com/huggingface/transformers/commit/e80a65ba4fbbf085fda2cf0fdb0e8d48785979c8 * https://github.com/huggingface/accelerate/commit/8ade23cc6aec7c3bd3d80fef6378cafaade75bbe * https://github.com/pytorch/pytorch/commit/e429a3b72e787ddcc26ee2ba177643c9177bab24 Can be reproduced running Huggingface Transformers tests for a number of models (such as albert, mpt, gemma2). Here is example for one of the model:  CC:      ",2024-11-18T18:50:50Z,triaged enhancement module: xpu,open,1,2,https://github.com/pytorch/pytorch/issues/140965,"Regarding the missed operation, we will support it on top of mkl library. Currently, the timeline is supposed to be PT 2.8 or PT 2.7.", : can we add `aten::_linalg_eigvals` for automated CPU fallback while we are waiting for the actual implementation of `aten::_linalg_eigvals` for XPU in PT2.7/2.8?
transformer,[export][quant] AttributeError: 'FunctionalTensor' object has no attribute '_quantized_linear_op'," 🐛 Describe the bug I'm trying to export a model to use w8/a8 quantisation. In my example, I'm using BERT.  However running `torch.export` fails with `AttributeError: 'FunctionalTensor' object has no attribute '_quantized_linear_op'` A traceback is here: Traceback      My code is here:   Versions  ",2024-11-18T12:11:49Z,oncall: pt2 oncall: export,open,0,0,https://github.com/pytorch/pytorch/issues/140943
