transformer,[MPS] Regression from macOS 14.3 to 14.4 in PyTorch 2.2.0/2.2.1," 🐛 Describe the bug I've been using a pytorch model daily through transformers (https://github.com/khawhite/mangaocr) and MPS. Everything was fine with latest PyTorch and latest Transformers until the Sonoma 14.4 update which made it start crashing on startup (I was running 14.3 before and am on a M1 Max mac, for reference). Since CPU mode worked fine, I also tried older versions of PyTorch and I found anything before 2.2.0 worked fine. Bisecting it I found this commit is causing it: https://github.com/pytorch/pytorch/commit/056d6247c786f4391bc6a6f21337b009c7e9699e . I tried building latest main with that commit reverted and it's working again. I apologize but I've not been able to pinpoint this further or to write a standalone example (since I don't really know what I'm doing here). I've looked at what's happening from within transformers but not sure any of this can be of help: It seems in https://github.com/huggingface/transformers/blob/main/src/transformers/generation/beam_search.pyL318 in input_ids the first member of each tensor array differs with or without that commit: e.g. With: tensor([[3463342888,          2,       2312,       4080,       5063,       4885,               3600,       5764,       5554,       4798,       1074,       3386,               2865,       2166,       1524,       1858,       2872,       4014,               5250,       1225,       2119,       1104,       1682,       5730,               1482,       5578,         78],        [3463342888,          2,       2312,       4080,       5063,       4885,               3600,       5764,       5554,       4798,       1074,       3386,               2865,       2166,   ",2024-03-16T01:30:50Z,high priority triaged module: regression module: correctness (silent) module: mps,closed,0,7,https://github.com/pytorch/pytorch/issues/122016,"Sorry, can you please be a bit more specific of what do you mean by ""crashes at the startup""? I'm on 14.4 and everything seems to be working fine at the first glance, i.e.:  Hmm, though indeed `from manga_ocr import MangaOcr` seems to work on 14.3, but fails on 14.4","Ok, I think I have a minimal reproducer of the problem ","And following fixes the problem, which makes me wonder how this ever worked before: "," if you don't mind explaining, what does copy_and_sync and non_blocking do vs copy? Just for learning thanks! found this: https://github.com/pytorch/pytorch/blob/5030913d6aed153afe45c9d9bcb6145093eb5629/aten/src/ATen/mps/MPSStream.mmL193L207"," Looking for a good vendorneutral document on the subject but could not find one. In general, nonblocking operations, as name suggests are nonblocking, i.e. operation might still be ongoing when one returns to a function calls (see `glFlush` API description dating back to 1991 ) In practice, imagine one is running the following code:  vs  I.e. by default GPU operations are executed asynchronously( so timing it on CPU doesn't make much sense, as it will only memory time required to reserve memory and enqueue respective commands)","Thanks for the breakdown  !  Do you have an idea of why   previously had the result of [0, 3, 3]? Seem like in any asynchronous scenario, there would be at most one 3. How'd it get two 3s? ",validated with 2.3.0 
transformer,[DCP][FSDP2][Test] Add_adamW to test_train_parity_2d_transformer_checkpoint_resume,"Want to add the option of AdamW here, as currently this is the only test for 2D.  ",2024-03-15T22:55:33Z,oncall: distributed Merged ciflow/trunk topic: not user facing ciflow/periodic,closed,0,8,https://github.com/pytorch/pytorch/issues/122002, merge, Merge started Your change will be merged once all checks pass (ETA 04 Hours). Learn more about merging in the wiki. Questions? Feedback? Please reach out to the PyTorch DevX TeamAdvanced Debugging Check the merge workflow status  here ," Merge failed **Reason**: 2 mandatory check(s) failed.  The first few are:  .github/workflows/pull.yml / linuxjammypy3.8gcc11 / build  .github/workflows/pull.yml / linuxfocalcuda12.1py3.10gcc9sm86 / test (default, 5, 5, linux.g5.4xlarge.nvidia.gpu) Dig deeper by viewing the failures on hud Details for Dev Infra team Raised by workflow job Failing merge rule: Core Maintainers ", rebase, started a rebase job onto refs/remotes/origin/viable/strict. Check the current status here,"Successfully rebased `add_adamW_to_test_train_parity_2d_transformer_checkpoint_resume` onto `refs/remotes/origin/viable/strict`, please pull locally before adding more changes (for example, via `git checkout add_adamW_to_test_train_parity_2d_transformer_checkpoint_resume && git pull rebase`)", merge, Merge started Your change will be merged once all checks pass (ETA 04 Hours). Learn more about merging in the wiki. Questions? Feedback? Please reach out to the PyTorch DevX TeamAdvanced Debugging Check the merge workflow status  here 
transformer,[ONNX] ONNX model has mismatching data type when Torch model and checkpoint dtype mismatches," 🐛 Describe the bug The HF's Whisper model has checkpoints saved with `torch.float16`, but the user script casts it to `torch.float32`. After the export finishes, the checkpoint is used to cerate ONNX Weights, which will result in a model expecting `float32` while the weights are stored with `float16`  The checker error would be something like `onnx.onnx_cpp2py_export.shape_inference.InferenceError: [TypeInferenceError] Inferred elem type differs from existing elem type: (FLOAT16) vs (FLOAT)`  Versions main",2024-03-15T19:46:41Z,module: onnx triaged onnx-triaged release notes: onnx,closed,0,0,https://github.com/pytorch/pytorch/issues/121986
transformer,AdamW(fused=True) slower than unfused AdamW," 🐛 Describe the bug 512M parameters Mostly vanilla LM transformer. FlashAttention 2.4.2, PyTorch 2.2.0. Uses both FA and FlashRotary. Dtype: bf16 Nvidia A40. singleGPU Unfused: 85 TFLOPS Fused: 68 TFLOPS  Versions PyTorch version: 2.2.0 Is debug build: False CUDA used to build PyTorch: 12.2 ROCM used to build PyTorch: N/A OS: Ubuntu 22.04.3 LTS (x86_64) GCC version: (Ubuntu 11.4.01ubuntu1~22.04) 11.4.0 Clang version: Could not collect CMake version: version 3.28.1 Libc version: glibc2.35 Python version: 3.10.12 (main, Nov 20 2023, 15:14:05) [GCC 11.4.0] (64bit runtime) Python platform: Linux5.19.17coreweavex86_64withglibc2.35 Is CUDA available: True CUDA runtime version: 12.2.140 CUDA_MODULE_LOADING set to: LAZY GPU models and configuration: GPU 0: NVIDIA A40 Nvidia driver version: 525.147.05 cuDNN version: Probably one of the following: /usr/lib/x86_64linuxgnu/libcudnn.so.8.9.6 /usr/lib/x86_64linuxgnu/libcudnn_adv_infer.so.8.9.6 /usr/lib/x86_64linuxgnu/libcudnn_adv_train.so.8.9.6 /usr/lib/x86_64linuxgnu/libcudnn_cnn_infer.so.8.9.6 /usr/lib/x86_64linuxgnu/libcudnn_cnn_train.so.8.9.6 /usr/lib/x86_64linuxgnu/libcudnn_ops_infer.so.8.9.6 /usr/lib/x86_64linuxgnu/libcudnn_ops_train.so.8.9.6 HIP runtime version: N/A MIOpen runtime version: N/A Is XNNPACK available: True CPU: Architecture:                    x86_64 CPU opmode(s):                  32bit, 64bit Address sizes:                   48 bits physical, 48 bits virtual Byte Order:                      Little Endian CPU(s):                          96 Online CPU(s) list:             095 Vendor ID:                       AuthenticAMD Model name:                      AMD EPYC 7413 24Core Proce",2024-03-13T22:09:35Z,module: performance module: optimizer triaged,open,0,21,https://github.com/pytorch/pytorch/issues/121857,"hmm this is concerning. Do you mind sharing a description of the sizes of your parameters? and whether you were using AMP/needing a gradscaler? I would guess no since you’re using bf16 and not fp16, but wanted to rule out possible culprits","n_layer: 12 n_head: 12 kv_heads: 6 (GQA) hidden_dim: 1536 n_tokens: 2048 (context length) vocab_dim: 65536 activation: ""swiglu"" No AMP/gradscaler. If a profile would help, I can produce one.",a profile would be helpful yes!,"These `trace.json` files were gigantic (multiGB), so here's smaller versions without stack information and on two steps only: https://drive.google.com/file/d/1c2CQST_U_Qf6O1qgSXr0DKVorytoNgp5/view?usp=sharing https://drive.google.com/file/d/1NCi6frLbXfVhL0pzdmwoRzmYLtFKqeQ/view?usp=sharing Torch.compile mode is the default (not ""reduceoverhead"") and my TFLOPS are constant starting from the second step, so skipping just 1 step of warmup seems ok. The program is being launched by `torchrun` on a 1GPU machine.",Turns out the step count isn't an issue with stack information disabled. Here's 3 steps: Unfused: https://drive.google.com/file/d/1OKuJVC3PPK5vn6TWdi1vPD8bAoHP7h4/view?usp=sharing Fused: https://drive.google.com/file/d/1CUeKkwiOMEHRJaNZlC65utq6WuS7Fxh4/view?usp=sharing,"Oh! Wait a moment...are you comparing torch.compile(step) vs step of AdamW(fused=True)? torch.compile(step) does the vertical fusion by default so it being faster is reasonable (and the point haha)! If you're comparing eager (non compiled) step between (fused=True) and the default (), then the fused should be faster.","No: torch.compile is wrapping forward and loss, but backward and AdamW are outside the compile. So it's: torch.compile(forward+loss but not backward+AdamW) + unfused AdamW vs  torch.compile(forward+loss but not backward+AdamW) + fused AdamW ","Ah, thanks for that, I was looking for the optimizer stuff in the torch compiled region and getting confused. I did look at both the traces and you're right the fused kernel is slower. In detail: The default AdamW uses a series of foreach ops, and the part in the trace this corresponds to is:  Whereas the fused AdamW is a foreach_add (step update) followed by one single fused kernel, and the part in the trace this corresponds to is:  : 1. While the fused implementation correctly launches fewer kernels (one fused_adamw instead of a bunch of foreach_* kernels), each kernel is so much slower! Each fused_adamw kernel takes ~6.5ms whereas a single foreach_* kernel is only 0.2ms (30 times slower!) Why is the fused op so much slower? 2. Whereas there are 137 kernels launched per foreach op, there are 75 kernels launched for the fused (due to the multi_tensor_apply chunking logic). For the same number of tensor inputs, I'm surprised there are _more_ kernels launched in the smaller foreach ops. Do you know what accounts for this?","pytorch v2.2.0 doesn't seem to have CC(fused adam(w): Reduce register usage), 2.2.1, either by looking at https://github.com/pytorch/pytorch/blob/v2.2.1/aten/src/ATen/native/cuda/fused_adam_utils.cuh. So I guess a nightly would be worth trying",Instructions for installing nightly can be found in the toggle system of https://pytorch.org/,"My CUDA version is 12.2, and PyTorch only lists 12.1 in its nightlies. Is that still ok for me to install?","Yes, I think so","It broke when trying to run with PyTorch Nightly, mismatched CUDA versions.  Debugging this isn't your issue though. Updating from CW's stable to CoreWeave's nightly images a few days ago (http://ghcr.io/coreweave/mlcontainers/nightlytorchextras:999655bnccl2024.03.11.05cuda12.2.2ubuntu22.04nccl2.19.31torch2.3.0a0vision0.18.0a0audio2.2.0a0flash_attn2.4.2) produced NaNs in backward, but that also isn't your issue. (I also can't switch my container easily.) It seems I don't have a good way to install PyTorch nightly on my current system.","Here's PyTorch nightly profiles (CUDA 12.2, 2.3.0a0+3eb322f). torch.compile broke, so I turned it off for forward+loss. Performance is much closer; unfused is only a little bit faster than fused. https://drive.google.com/file/d/1k8zoSGeK7Pr5jst_MU4u6HJS6lhikUcl/view?usp=sharing https://drive.google.com/file/d/1weyCOEAnnte0rJ45qFEvNR1UYpYmTE0/view?usp=sharing","Thank you for getting the traces! It is surprising that the fused step is still slower than the foreach...but a look at the trace shows that we only get 67% occupancy per fused adam kernel and 100% occupancy for each foreach op kernel.  why could this be the case? Unfused, 100% occupancy  Fused, 67% occupancy  The fused kernel does use almost twice as many registers, but it might just be due to it doing more work, but it shouldn't be doing more work than the sum of the foreach ops. btw 's occupancy changes (with dynamic chunking) will help make both impls faster.","As a side note, I tried `.compile` on PyTorch's unfused AdamW, after you mentioned it. TFLOPS goes from 85 to 4, haha. It's because `torch.compile` keeps recompiling when the LR changes (which is inevitable with a learning rate scheduler).","Haha thank you for gathering the number there (though it's abysmal :() Is this true even when you wrap lr into a tensor? like torch.tensor(lr)?  There is a tracking issue for lr:  CC(Using torch.compile, batch training step time takes long to converge when adding a LR Scheduler) that is in progress  ","Using `AdamW(lr=torch.tensor(...))` with scheduler active, TFLOPS went from 85 to 88. Zoom zoom! LR scheduler is LambdaLR with regular nontensor floats.","icy χατγιρλ:  I can reproduce the performance dropoff under torch 2.2 icy χατγιρλ: compiling only forward + loss, enabling the fused optimizer completely destroys the performance icy χατγιρλ: but on 2.4 nightly, enabling fused helps a tiny bit"," just a heads up there was a regression in fused optimizers in the past few days. https://github.com/pytorch/pytorch/pull/123566 should fix it. > we only get 67% occupancy per fused adam kernel and 100% occupancy for each foreach op kernel  the foreach version materializes intermediate results into global memory at every step. The fused version only materializes the final results, which requires more registers per thread and can lead to lower occupancy. I think it's normal for the fused version to be faster while having lower occupancy, because it avoids doing a lot of expensive memory I/O.","PyTorch nightly: fused AdamW 69.5 TFLOPS unfused AdamW 70.5 TFLOPS One of the two fused AdamW runs has a wobbly TFLOPS line, going up and down around 69.5.  "
transformer,The warning message in aten/src/ATen/native/transformers/sdp_utils_cpp.h::check_for_attn_mask is a bit confusing.," 🐛 Describe the bug The warning message at https://github.com/pytorch/pytorch/blob/v2.1.0/aten/src/ATen/native/transformers/sdp_utils_cpp.hL258, 'Both fused kernels do not support nonnull attn_mask,' does it mean that FlashAttention and MemEfficient do not support  nonnull attn_mask? However, at::_scaled_dot_product_efficient_attention does support  nonnull attn_mask, so should the warning message be updated?    Versions ",2024-03-13T02:54:53Z,,closed,0,1,https://github.com/pytorch/pytorch/issues/121783,"Ahh you are right, I will send a PR Updating"
transformer,Does PyTorch need to expose the header files in the aten/src/ATen/native/transformers directory to the client?," 🚀 The feature, motivation and pitch Now, I am adapting at::scaled_dot_product_attention to a specific type of cudalike device and encounters a problem.   Firstly, since aten/src/ATen/native/transformers/sdp_utils_cpp.h is not exposed to client, I need to write a lot of repeated checking code in my select_sdp_backend Secondly, since aten/src/ATen/native/transformers/attention.h is not exposed to client, I need to write the following code when registering _fused_sdp_choice_stub  The above issues arose in the context of planning to support PrivateUse1 at https://github.com/pytorch/pytorch/blob/v2.1.0/aten/src/ATen/native/transformers/attention.cppL674. Following the approach at  CC(How to adapt to `at::scaled_dot_product_attention`'s routing logic for a third-party cuda-like device?) would avoid these issues, but it requires a lot of repetitive code.      Alternatives _No response_  Additional context _No response_",2024-03-12T11:20:09Z,triaged module: PrivateUse1,closed,0,2,https://github.com/pytorch/pytorch/issues/121720,"From Nikita: short term, exposing headers like this seems ok. Longer term, there should be a BE project to more clearly decide what we want to expose / not expose.",https://github.com/pytorch/pytorch/pull/122586
transformer,[DTensor] Moved `Transformer` sharding to staticmethod,"  CC([no ci][WIP] Supported 2D `clip_grad_norm_`)  CC([DTensor] Moved `Transformer` sharding to staticmethod)  CC([FSDP2][BE] Refactored `check_1d_sharded_parity` to use mesh)  CC([FSDP2] Relaxed check for parent mesh) To support FSDP + TP/SP unit tests, let us factor out the canonical TP/SP sharding of `Transformer` to a staticmethod that can be called by other unit tests. Test Plan:  ",2024-03-11T19:33:38Z,oncall: distributed triaged Merged ciflow/trunk topic: not user facing,closed,0,6,https://github.com/pytorch/pytorch/issues/121660, merge, Merge started Your change will be merged once all checks pass (ETA 04 Hours). Learn more about merging in the wiki. Questions? Feedback? Please reach out to the PyTorch DevX TeamAdvanced Debugging Check the merge workflow status  here ," Merge failed **Reason**: 1 mandatory check(s) failed.  The first few are:  pull / linuxfocalcuda12.1py3.10gcc9 / test (default, 5, 5, linux.4xlarge.nvidia.gpu) Dig deeper by viewing the failures on hud Details for Dev Infra team Raised by workflow job Failing merge rule: Core Maintainers ","Failure in pull / linuxfocalcuda12.1py3.10gcc9 / test (default, 5, 5, linux.4xlarge.nvidia.gpu) looks unrelated: ", merge i," Merge started Your change will be merged while ignoring the following 1 checks: pull / linuxfocalcuda12.1py3.10gcc9 / test (default, 5, 5, linux.4xlarge.nvidia.gpu) Learn more about merging in the wiki. Questions? Feedback? Please reach out to the PyTorch DevX TeamAdvanced Debugging Check the merge workflow status  here "
transformer,guard on tensor parallelism test examples,This task is to add some guards to the tensor parallelism test examples to ensure we incurred the right collectives: https://github.com/pytorch/pytorch/blob/main/test/distributed/tensor/parallel/test_tp_examples.py Specifically we can follow this logic to assert on the communication collectives incurred using the CommDebugMode https://github.com/pytorch/pytorch/blob/main/test/distributed/tensor/parallel/test_tp_examples.pyL100 The test example we want to add this guard on is the Transformer e2e training example https://github.com/pytorch/pytorch/blob/main/test/distributed/tensor/parallel/test_tp_examples.pyL179 ,2024-03-11T18:21:34Z,oncall: distributed triaged pt_distributed_rampup,closed,0,0,https://github.com/pytorch/pytorch/issues/121649
transformer,Compiling SwinTransformer encoder fail with input size changes, 🐛 Describe the bug Compiling SwinTransformer forward at https://github.com/yoxu515/aotbenchmark/blob/paot/networks/encoders/swin/swin_transformer.pyL684 It is going to work correctly at training time when it works on a fixed input crop. It is going to fail instead at inference when the input size change.  Error logs   Minified repro _No response_  Versions last `pytorchnightly` official docker image. ,2024-03-11T14:54:55Z,triaged ezyang's list oncall: pt2 module: dynamic shapes,closed,0,11,https://github.com/pytorch/pytorch/issues/121637,"Thanks for the report . Did you try diagnosing with the doc linked in the error message? At some point I can take a look, but the full model repro instructions would be useful.","If we follow the docs in the report and log is correct  we have  That  it seems to generate the `setitem`: `While executing %setitem : [num_users=0] = call_functiontarget=operator.setitem, slice(0, 7, None), slice(0, 7, None), slice(None, None, None)), 0), kwargs = {})` `h` and `w` could be variable at inference and they are constant in training. The docs is relative to `datadependent control flow` but here there is not an explicit control flow in the user code but probably it is in the underline generated code. > But the full model repro instructions would be useful. As this model is a good source of many compiler errors I have already shared some instruction in other tickets to setup the environment with the hope you could adopt this model more in general to stress test the compiler:  CC(Pytorch 2.2 regression)issuecomment1924745100 In this case we need to run the `eval.py` on different image sizes.",I think it may work to explicitly test with `torch._check` that the h and w are in bounds for `img_mask` before doing the index. Your simplified code looks relatively simple and can take a look later., Compiling other components of the same model I am getting this with the last nightly    As I have already different compiler open tickets on this model is there any opportunity that the compiler team could adopt it (as it is a public repo) to stress test the compiler?,/://github.com/pytorch/pytorch/issues/121504. Then we have also another open ticket same model at  CC(Pytorch 2.2 regression), Is it possible that something is missing cause how it handles slices? > I think it may work to explicitly test with torch._check that the h and w are in bounds for img_mask before doing the index. Your simplified code looks relatively simple and can take a look later.  Cause manually adding `torch._check` in the loop for W and H and transforming slices in range it is working. And then it is failing just few row later with the same bug for:  ,"Do the same trick but with the downsampled sizes. We should do better for this case, but it is difficult because when you do a slice that is out of bounds, the semantics of PyTorch is to clamp to the max value, and this is painful to generate code for (we'd much rather know that the slice range is never out of bounds). Maybe we should introduce a variant of indexing which assumes everything is in range (this will also remove annoyances with negative indices). I think I'd be happy to add this model to our overall suite. If you are interested in rolling up your sleeves to do it, open a PR to https://github.com/pytorch/benchmark and then once it's in (I can help), I can add it to our torchbenchmark benchmark runs.","In the meantime I have create a workaround to not use python slices (it would be nice if at least when we find slices we could emit a more comprehensible error). But then later in the same function  function `x_out, H, W, x, Wh, Ww = layer(x, Wh, Ww)`  ","> I think I'd be happy to add this model to our overall suite. If you are interested in rolling up your sleeves to do it, open a PR to https://github.com/pytorch/benchmark and then once it's in (I can help), I can add it to our torchbenchmark benchmark runs. As  is trying to reproduce the same environment to check other compiler issues at  CC(Custom attention recompilations) I have asked if he he is already familiar with the benchmark repository. I could help for sure but I don't think I have the bandwidth to bootstrap the PR on my side as I need to find the time to check how the benchmark standard interface are organized in the repo. But I can support for everything related to the model for sure and compiler failures reproducibility with pytorch nightly versions.","For this one, try patching the line in `torch/_prims_common/__init__.py` to `guard_size_oblivious(y != expected_stride)` Also, https://docs.google.com/document/d/1HSuTTVvYH1pTew89Rtpeu84Ht3nQEFTYhAX3Ypa_xJs/editheading=h.44gwi83jepaj may be of interest",https://github.com/pytorch/pytorch/pull/122370 for the size oblivious here
transformer,"[BUG] Given boolean tgt_mask, TransformerDecoder produces wrong results with MPS backend"," 🐛 Describe the bug Two tokens are decoded in this example. Ideally, the output feature on the first token should be the same regardless of the sequence length as a square subsequent mask is applied. Here are two ways to generate the tgt mask. One is from the official example where a float mask is generated first but converted into a boolean mask later. Another way is to generate the boolean mask directly. :heavy_check_mark: If running with `cpu` backend, the three printed values should be the same:   ❌  However, if we run it on `mps` backend, the directly generated boolean mask would result in the wrong decoded feature for the first token. The result looked like this:  The bug can be reproduced by this minimal script:   Versions PyTorch version: 2.2.1 Is debug build: False CUDA used to build PyTorch: None ROCM used to build PyTorch: N/A OS: macOS 14.1 (arm64) GCC version: Could not collect Clang version: 15.0.0 (clang1500.1.0.2.5) CMake version: version 3.28.3 Libc version: N/A Python version: 3.11.7 (main, Dec 15 2023, 12:09:56) [Clang 14.0.6 ] (64bit runtime) Python platform: macOS14.1arm64arm64bit Is CUDA available: False CUDA runtime version: No CUDA CUDA_MODULE_LOADING set to: N/A GPU models and configuration: No CUDA Nvidia driver version: No CUDA cuDNN version: No CUDA HIP runtime version: N/A MIOpen runtime version: N/A Is XNNPACK available: True CPU: Apple M3 Max Versions of relevant libraries: [pip3] numpy==1.26.3 [pip3] pytorchlightning==2.2.0.post0 [pip3] torch==2.2.1 [pip3] torchaudio==2.2.1 [pip3] torchdata==0.7.1 [pip3] torchmetrics==1.3.0.post0 [pip3] torchtext==0.17.1 [pip3] torchvision==0.17.1 [conda] numpy            ",2024-03-11T13:16:51Z,module: nn triaged module: mps,open,0,1,https://github.com/pytorch/pytorch/issues/121632,I've tried device='cuda' or 'cpu'. There is nothing wrong. So it's might only linked to mps. !image
