transformer,DTensor sharding propagation for `scaled_dot_product_efficient_attention` should be more conservatively cached," 🐛 Describe the bug The current `DTensor` sharding propagation caching policy for  `aten.scaled_dot_product_efficient_attention` (default) can result in silently incorrect gradients or trigger an IMA after cuda kernel launch (bt below) in mixed `require_grad` configurations. Testing a variety of TP `requires_grad` patterns (validating mechanistic interpretability probing use cases among others) revealed that if the first `aten.scaled_dot_product_efficient_attention` sharding propagation has `compute_log_sumexp=False` (e.g. first Transformer block attention layer has `require_grad=False`), subsequent `aten.scaled_dot_product_efficient_attention` ops may reuse the sharding propagation cache inappropriately (e.g., for any later Transformer block attention layer that may have `requires_grad=True`) resulting in the aforementioned silent gradient incorrectness or IMA. For instance, the silent correctness scenario can be observed with the test referenced below using a simple twodevice mesh and the default `n_heads=4` Transformer config. It occurs because:   The corrupted cache triggers an extra sharding operation. `scaled_dot_product_efficient_attention_strategy` sets the `logsumexp` `DTensorSpec` to `Replicate()` and shape `[bs, n_heads, 0]`, triggering an unintended redistribute and `_replicate_to_shard` before the local backward op.  Using the `num_heads_dim_sharding` strategy, the shard placement `mesh_dim` equals `sqrt(n_heads)` so the extra sharding operation yields a `local_tensor_args` tensor that will not will not raise an IMA when passed to our cuda kernel     Alternatively, if `mesh_dim sizes()[0] $13 = (const long &) : 8 (gdb) p log",2024-08-20T21:13:57Z,oncall: distributed module: dtensor,closed,0,2,https://github.com/pytorch/pytorch/issues/134050,"cc: , l "," Thank you for helping identify the bug! We appreciate the report and the proposed solution. I agree to fix the bug we should simply adding `RuntimeSchemaInfo` for the two ops (efficient attention fwd, flash attention fwd). I'd suggest submitting a separate PR for this issue, both because it seems to be an independent problem, and because we need more time to digest the other issue. I can help review your PR. Since personally I believe this is a simple fix, it's up to you whether you'd like to merge without further testing, or modify the existing test cases/file for the two attentions in https://github.com/pytorch/pytorch/blob/main/test/distributed/_tensor/test_matrix_ops.py."
transformer,PyTorch torch.compile inductor fails to compile yolo.," 🐛 Describe the bug Reproducer:  Error:  This model compiles successfully with torch<=2.3.1.  Versions Collecting environment information... PyTorch version: 2.4.0+cu121 Is debug build: False CUDA used to build PyTorch: 12.1 ROCM used to build PyTorch: N/A OS: Ubuntu 22.04.2 LTS (x86_64) GCC version: (Ubuntu 11.4.01ubuntu1~22.04) 11.4.0 Clang version: 20.0.0git (https://github.com/llvm/llvmproject.git 0795ab4eba14b7a93c52c06f328c3d4272f3c51e) CMake version: version 3.29.3 Libc version: glibc2.35 Python version: 3.10.12 (main, Jul 29 2024, 16:56:48) [GCC 11.4.0] (64bit runtime) Python platform: Linux5.15.153.1microsoftstandardWSL2x86_64withglibc2.35 Is CUDA available: True CUDA runtime version: Could not collect CUDA_MODULE_LOADING set to: LAZY GPU models and configuration: GPU 0: NVIDIA RTX A3000 12GB Laptop GPU Nvidia driver version: 536.45 cuDNN version: Could not collect HIP runtime version: N/A MIOpen runtime version: N/A Is XNNPACK available: True CPU: Architecture: x86_64 CPU opmode(s): 32bit, 64bit Address sizes: 46 bits physical, 48 bits virtual Byte Order: Little Endian CPU(s): 24 Online CPU(s) list: 023 Vendor ID: GenuineIntel Model name: 12th Gen Intel(R) Core(TM) i712850HX CPU family: 6 Model: 151 Thread(s) per core: 2 Core(s) per socket: 12 Socket(s): 1 Stepping: 2 BogoMIPS: 4838.39 Flags: fpu vme de pse tsc msr pae mce cx8 apic sep mtrr pge mca cmov pat pse36 clflush mmx fxsr sse sse2 ss ht syscall nx pdpe1gb rdtscp lm constant_tsc rep_good nopl xtopology tsc_reliable nonstop_tsc cpuid pni pclmulqdq vmx ssse3 fma cx16 sse4_1 sse4_2 x2apic movbe popcnt tsc_deadline_timer aes xsave avx f16c rdrand hypervisor lahf_lm abm 3dnow",2024-08-17T10:37:36Z,triaged oncall: pt2 module: dynamic shapes module: inductor,closed,0,0,https://github.com/pytorch/pytorch/issues/133759
transformer,Enable DTensor sharding propagation of `native_layer_norm_backward` to more fully accommodate optional args,"Fixes CC(DTensor sharding propagation of `native_layer_norm_backward` does not fully accommodate optional args)  The issue Testing a variety of TP `requires_grad` patterns (validating maximally flexible finetuning) revealed `DTensor` sharding propagation of `aten.native_layer_norm_backward` (default) fails with an `IndexError` for certain `requires_grad` patterns (pattern 1) (e.g. `output_mask` `[True, False, False]`) and an `AssertionError` for others (pattern 2) (e.g. output mask `[False, True, *]`). Please see issue CC(DTensor sharding propagation of `native_layer_norm_backward` does not fully accommodate optional args) for a full description of the observed failure patterns along with reproduction.  Use Cases and Remediation Failure pattern 1 is potentially problematic for a variety of finetuning scenarios. Though failure pattern 2 is really an xfail right now since it's not fully supported, IMHO there are use cases (e.g. especially wrt to mechanistic interpretability research, but certain finetuning scenarios too potentially) that justify supporting this output mask (especially since supporting it is fairly straightforward I think). In this PR I propose some modest changes that:    * Address the aforementioned failure modes.   * Add a couple tests that I'm hopeful will help ensure `DTenso`r op dispatch (which is so well implemented and such a pleasure working with btw! :rocket: :tada:) accommodates a wide variety of (potentially unanticipated) `requires_grad` patterns as it evolves. To address both failure modes, I'm proposing the following changes: 1. To `torch.distributed._tensor.ops._math_ops.layer_norm_bwd_strategy`:    Refactor",2024-08-14T20:17:11Z,oncall: distributed triaged open source better-engineering Merged ciflow/trunk topic: not user facing ciflow/inductor module: dtensor,closed,0,2,https://github.com/pytorch/pytorch/issues/133502," merge f ""lint error is not related to this PR"""," Merge started Your change will be merged immediately since you used the force (f) flag, **bypassing any CI checks** (ETA: 15 minutes).  Please use `f` as last resort and instead consider `i/ignorecurrent` to continue the merge ignoring current failures.  This will allow currently pending tests to finish and report signal before the merge. Learn more about merging in the wiki. Questions? Feedback? Please reach out to the PyTorch DevX TeamAdvanced Debugging Check the merge workflow status  here "
transformer,DTensor sharding propagation of `native_layer_norm_backward` does not fully accommodate optional args," 🐛 Describe the bug Testing a variety of TP `requires_grad` patterns (validating maximally flexible finetuning) revealed `DTensor` sharding propagation of `aten.native_layer_norm_backward` (default) fails with the following `IndexError` (traceback below) with certain `requires_grad` patterns (e.g. `output_mask` `[True, False, False]`):  Pattern 1   Pattern 2 Additionally, the op fails (expectedly according to this comment) with the following `AssertionError` (traceback below) for the currently unsupported output mask `[False, True, *]`.  Though failure pattern 2 is not fully supported, IMHO there are usage patterns (e.g. especially wrt to mechanistic interpretability research, but certain finetuning scenarios too potentially) that justify supporting this output mask (especially since supporting it is fairly straightforward I think). In a PR I will submit shortly, I propose some modest changes that:  1. Address the aforementioned issues 2. Add a couple tests that I'm hopeful will help ensure `DTensor` op dispatch (which is so well implemented and such a pleasure working with btw! :rocket: :tada:) accommodates a wide variety of (potentially unanticipated) `requires_grad` patterns as it evolves.  To reproduce To reproduce the two failure patterns listed above as manifest with a variety of `output_mask` patterns, run the following test provided in the PR I'm submitting shortly associated with this issue. You should observe `8/20` subtests failing with the relevant subtest configurations provided:   Additionally, to reproduce a specific failure patterns with the standard `DTensor` test Transformer, one can run the following new test parameter",2024-08-14T20:06:40Z,oncall: distributed triaged module: dtensor,closed,2,5,https://github.com/pytorch/pytorch/issues/133499,"Thanks a lot for the report and the PR! We appreciate them! We happen to be planning on some changes to how layer norm does sharding propagation in DTensor. Specifically we might need to create candidate sharding options (like we do for matmul ops), instead of propagating along inputs sharding. Let us carefully study your report and PR and see if it aligns with / contributes to the new strategy we need. cc:  ","> Thanks a lot for the report and the PR! We appreciate them! We happen to be planning on some changes to how layer norm does sharding propagation in DTensor. Specifically we might need to create candidate sharding options (like we do for matmul ops), instead of propagating along inputs sharding. >  > Let us carefully study your report and PR and see if it aligns with / contributes to the new strategy we need. >  > cc:  Happy to contribute! The distributed team's code is always a pleasure to work with, shrewdly designed and adroitly implemented. 🎉 🚀  I definitely appreciate the API is still evolving but whatever portions of the PR could be merged (even the test refactor) would be helpful while the candidate sharding option is being explored (agreed something akin to `gen_einsum_strategies` could be useful!).  I'm the primary maintainer of a downstream package (FineTuning Scheduler) and am currently adding support for the DTensor APIs and FSDP2 etc. I'm also planning to experiment with using DTensor dispatch for some mechanistic interpretability research functionality so if the team wants to solicit thoughts from the user base on anticipated usage patterns beyond the typical RFCs I'd be glad to provide any feedback that could be useful.  Anyway, if you think about it, please tag me once the candidate sharding refactor work gets going. Thanks again for your work!!","Thanks  for reporting the issue and categorizing it into 2 patterns which largely help us understand the problem. 1. for pattern 1, this is a mistake in `layer_norm_bwd` implementation. I misunderstood that when `output_mask[1] = False` and `weight` is not `None, the desired spec should still be added to the list. Your fix in PR should address this. 2. for pattern 2, your fix in PR complements the missing case support.  The PR looks good to me on these 2 parts, but my question is on the decision on filtering `None` from `args_spec` or `desired_specs` because they should contain no `None` objects.","> Thanks  for reporting the issue and categorizing it into 2 patterns which largely help us understand the problem. >  Thanks for all your great contributions, they're a pleasure working with! > 1. for pattern 1, this is a mistake in `layer_norm_bwd` implementation. I misunderstood that when `output_mask[1] = False` and `weight` is not `None, the desired spec should still be added to the list. Your fix in PR should address this. > 2. for pattern 2, your fix in PR complements the missing case support. >  > The PR looks good to me on these 2 parts, but my question is on the decision on filtering `None` from `args_spec` or `desired_specs` because they should contain no `None` objects. I just had a chance to review your PR suggestions this morning. I had more conservatively refactored `layer_norm_bwd_strategy`, always adhering to the full op schema for the target input specs (i.e. including `None` for optional args) to ensure alignment with `op_schema.args_spec` but your suggestion that it should be safe to rely on the presence of `(weight|bias)_strategy` allowed me to push a `layer_norm_bwd_strategy` refactor that obviates the need for the referenced `None` filtering and it's now been removed. Thanks again for your thoughtful collaboration! ","close this issue as https://github.com/pytorch/pytorch/pull/133502 has been merged. Again, really appreciate  for the detail issue report and quick fix!! "
transformer,[FSDP2] Added eager fast-path for fp32->bf16 param cast,"  CC([FSDP2] Added eager fastpath for fp32>bf16 param cast)  CC([FSDP2] Set `ctx.set_materialize_grads(False)` for postbackward) Some recommendation models have a high number of `nn.Parameter`s. This exacerbates pertensor CPU overheads in FSDP2 compared to FSDP1. This PR adds a fastpath for the common bf16/fp32 mixed precision case for the casting the parameters from fp32 to bf16 to reduce CPU overhead and possibly have more efficient copy.  Old: `for` loop + `.to(torch.bfloat16)`, incurring dispatcher overhead per parameter  New: `torch.empty` + `torch.split` + `torch._foreach_copy_`, incurring three dispatches  Example on Llama38B which does not have many `nn.Parameter`s (compared to recommendation models): (Old) on Llama38B (0.46 ms CPU overhead for allgather): !Screenshot 20240813 at 6 19 39 PM (New) on Llama38B (0.37 ms CPU overhead for allgather): !Screenshot 20240813 at 6 20 32 PM  Same example as above but now with float8 allgather: (Old) on Llama38B with float8 (0.996 ms CPU overhead for allgather): !Screenshot 20240815 at 11 27 46 AM (New) on Llama38B with float8 (1.014 ms CPU overhead for allgather): !Screenshot 20240815 at 11 26 33 AM The times are relatively comparable for float8 with the new one possibly slightly slower, but this is mainly because for Llama's transformer blocks, there are only two norm weights that need to cast to bf16. These screenshots are mainly to show that the optimization still works in the mixed case. : D61236983",2024-08-13T22:15:14Z,oncall: distributed Merged ciflow/trunk ciflow/inductor release notes: distributed (fsdp2),closed,0,5,https://github.com/pytorch/pytorch/issues/133369," has imported this pull request.  If you are a Meta employee, you can view this diff on Phabricator."," has imported this pull request.  If you are a Meta employee, you can view this diff on Phabricator.","cc:  depending on how many weights use fp8, the fp8 casting CPU overhead, even with the precompute, might become a problem", merge, Merge started Your change will be merged once all checks pass (ETA 04 Hours). Learn more about merging in the wiki. Questions? Feedback? Please reach out to the PyTorch DevX TeamAdvanced Debugging Check the merge workflow status  here 
transformer,"[Torch.Export] [OpenELM] Failed to Export OpenELM: ""Pop from Empty List"""," 🐛 Describe the bug When I was trying to export OpenELM  I was hit by   Versions Tried both torch `2.3.0` and `2.4.0`, both fails Transformers version is `4.38.2` ",2024-08-12T18:45:29Z,export-triaged oncall: export,closed,0,3,https://github.com/pytorch/pytorch/issues/133252," Sorry we just got to this, the embedding weights seem to be not tracked properly, I'll look into this."," if you're able to use nonstrict mode export `export(strict=False)` I would recommend it while we work on this, nonstrict seems to export successfully.",Also putting up https://github.com/pytorch/pytorch/pull/134500 to fix this
transformer,[torch.compile] Integers stored on nn.Modules as dynamic causing errors," 🐛 Describe the bug reporduce code  The above code is fine on 2.3, but it will throw an error on 2.4 and the main branch. What is error looks like:  This seems to be a problem with inductor or triton, but it is actually because *self.num_heads* is dynamic. This phenomenon occurred after this commit:  CC([torch.compile] nn.Module int/float attributes caused re-compile) The problem is that torch made all ints in nn.Module dynamic, but this is actually not necessary. I understand that there will be an automatic dynamic mechanism for this in the future, but for the moment if I can have a simple way to avoid the problems.  Versions  ",2024-08-10T13:47:51Z,high priority triaged actionable oncall: pt2 module: dynamic shapes,open,1,5,https://github.com/pytorch/pytorch/issues/133166,pytorch 2.4 release error infomation: !image,:  CC([torch.compile] nn.Module int/float attributes caused re-compile) ,"Adding insult to injury there's no way to force the integer to be static lol. Well, I guess you could do something like `tensor_num_heads = torch.empty((num_heads, 0))` and then `num_heads = tensor_num_heads.size(0)` LOL",It looks like this is causing many errors internally,"I actually circumvent this problem by using warmup. I don't specifiy dynamic=True, but use default setting. Then I warmup with inputs of different lengths. Eventually, the dimension of the sequence length become dynamic, while num_heads is still static, which serves my purpose."
transformer,Fixing Pytorch RMS norm implementation,"Since FP16 has quite small dynamic range it is very easy to overflow while computing `at::pow(input, 2)` , and it happens in real world computation. I've tried to use `nn.RMSNorm` fused implementation instead of `LlamaRMSNorm` inside `transformers` implementation of Llama (`src/transformers/models/llama/modeling_llama.py`). It started to give wrong answers in Fp16 while still giving good in FP32. I figured out happens due to overflow while computing square of the input tensor. Original `LLamaRMSNorm` implementation upcasts input to fp32 to prevent this and give better numerical stability.  Proposed commit fixed the issue. FP16 in RMSNorm has to be treated in special way, to be usable in real world implementations.",2024-08-09T10:02:21Z,triaged open source,closed,0,7,https://github.com/pytorch/pytorch/issues/133085," :x:  login:  / name: Karol Kontny . The commit (c79577d3d55483360ac339b14f605656d3f30c42, 6458021f9eaa4e13d3bb63d08df361286c424d65) is not authorized under a signed CLA. Please click here to be authorized. For further assistance with EasyCLA, please submit a support request ticket.",> Could you sign CLA in  CC(Fixing Pytorch RMS norm implementation) (comment) please I have to process the CLA through the company legal. Unfortunately it will be probably done early next week.," would you mind if I open this PR again instead? Its blocking me as well, want to get it in as soon as possible",">  would you mind if I open this PR again instead? Its blocking me as well, want to get it in as soon as possible  Please go on, I tried to hurry them, but with no effect. It takes much more time than it should...", I have created a PR here: https://github.com/pytorch/pytorch/pull/134106, I think we can close this. this has been fixed now in https://github.com/pytorch/pytorch/pull/134106,Fixed via CC(fix for fp16) 
transformer,Optimize test_transformers.py," Reduced number of skipped test cases  Merged redundant test cases **Benchmark:**  _These are approximate numbers from running test_transformers.py on a single H100, and can change based on the device._",2024-08-08T23:31:50Z,Merged ciflow/trunk topic: not user facing,closed,0,2,https://github.com/pytorch/pytorch/issues/133049, merge, Merge started Your change will be merged once all checks pass (ETA 04 Hours). Learn more about merging in the wiki. Questions? Feedback? Please reach out to the PyTorch DevX TeamAdvanced Debugging Check the merge workflow status  here 
transformer,Optimize test transformers,Fixes ISSUE_NUMBER,2024-08-08T23:20:11Z,,closed,0,0,https://github.com/pytorch/pytorch/issues/133046
transformer,Exclude test_transformers and unit tests which require recent GPU arch,This PR is to exclude test_transformers on ROCm temporarily and skip some unit tests which require recent GPU arch. ,2024-08-07T16:56:32Z,oncall: distributed triaged open source Merged topic: not user facing ciflow/periodic ciflow/inductor rocm rocm priority keep-going ciflow/rocm ciflow/inductor-rocm,closed,0,38,https://github.com/pytorch/pytorch/issues/132895, label ciflow/rocm, label keepgoing, rebase, started a rebase job onto refs/remotes/origin/viable/strict. Check the current status here,"Successfully rebased `0807_test_results_info` onto `refs/remotes/origin/viable/strict`, please pull locally before adding more changes (for example, via `git checkout 0807_test_results_info && git pull rebase`)", rebase, started a rebase job onto refs/remotes/origin/viable/strict. Check the current status here,"Successfully rebased `0807_test_results_info` onto `refs/remotes/origin/viable/strict`, please pull locally before adding more changes (for example, via `git checkout 0807_test_results_info && git pull rebase`)", rebase, started a rebase job onto refs/remotes/origin/viable/strict. Check the current status here,"Successfully rebased `0807_test_results_info` onto `refs/remotes/origin/viable/strict`, please pull locally before adding more changes (for example, via `git checkout 0807_test_results_info && git pull rebase`)", rebase, started a rebase job onto refs/remotes/origin/viable/strict. Check the current status here,"Successfully rebased `0807_test_results_info` onto `refs/remotes/origin/viable/strict`, please pull locally before adding more changes (for example, via `git checkout 0807_test_results_info && git pull rebase`)", rebase, started a rebase job onto refs/remotes/origin/viable/strict. Check the current status here,"Successfully rebased `0807_test_results_info` onto `refs/remotes/origin/viable/strict`, please pull locally before adding more changes (for example, via `git checkout 0807_test_results_info && git pull rebase`)", rebase, started a rebase job onto refs/remotes/origin/viable/strict. Check the current status here,"Successfully rebased `0807_test_results_info` onto `refs/remotes/origin/viable/strict`, please pull locally before adding more changes (for example, via `git checkout 0807_test_results_info && git pull rebase`)", rebase, started a rebase job onto refs/remotes/origin/viable/strict. Check the current status here,"Successfully rebased `0807_test_results_info` onto `refs/remotes/origin/viable/strict`, please pull locally before adding more changes (for example, via `git checkout 0807_test_results_info && git pull rebase`)", rebase, started a rebase job onto refs/remotes/origin/viable/strict. Check the current status here,"Successfully rebased `0807_test_results_info` onto `refs/remotes/origin/viable/strict`, please pull locally before adding more changes (for example, via `git checkout 0807_test_results_info && git pull rebase`)", label ciflow/trunk
transformer,[Memory] snapshot wrong with optimizer_state and gradient - 🤗 Transformers," 🐛 Describe the bug  Training GPT2XL with 🤗 Transformers and 🤗 Accelerate  Using _record_memory_history and _dump_snapshot for profiler Training GPT2XL with 🤗 Transformers, optimizer set to adamw_torch. Since we are using adamw, the memory of optimizer_state should be 2 times of gradient if fp32training, or 6 times of gradient if fp16 or bf16training. However, from the snapshot, the optimizer_state is always the 2 times of gradient, which is obviously impossible. Reproduce  model: GPT2XL  batch size: 4  sequence length: 1024  single GPU  optimizer: adamw_torch  bf16  !Trace_gpt2xldataset_alpacagpus1bs4seq1024lr0 0004linearbf16_step_3_to_5  Versions PyTorch version: 2.2.2+cu121 Is debug build: False CUDA used to build PyTorch: 12.1 ROCM used to build PyTorch: N/A OS: Ubuntu 20.04 LTS (x86_64) GCC version: Could not collect Clang version: Could not collect CMake version: version 3.16.3 Libc version: glibc2.31 Python version: 3.10.14 (main, Mar 21 2024, 16:24:04) [GCC 11.2.0] (64bit runtime) Python platform: Linux5.4.0155genericx86_64withglibc2.31 Is CUDA available: True CUDA runtime version: 12.2.91 CUDA_MODULE_LOADING set to: LAZY GPU models and configuration:  GPU 0: NVIDIA A800SXM480GB GPU 1: NVIDIA A800SXM480GB GPU 2: NVIDIA A800SXM480GB GPU 3: NVIDIA A800SXM480GB GPU 4: NVIDIA A800SXM480GB GPU 5: NVIDIA A800SXM480GB GPU 6: NVIDIA A800SXM480GB GPU 7: NVIDIA A800SXM480GB Nvidia driver version: 535.54.03 cuDNN version: Probably one of the following: /usr/local/cuda12.1/targets/x86_64linux/lib/libcudnn.so.9.1.0 /usr/local/cuda12.1/targets/x86_64linux/lib/libcudnn_adv.so.9.1.0 /usr/local/cuda12.1/targets/x86_64linux/lib/libcudnn_cnn.so.9.1",2024-08-07T10:04:12Z,module: optimizer triaged,closed,0,3,https://github.com/pytorch/pytorch/issues/132855, (not sure what label to add for memory snapshot),"Why should optim state take up 6 times of gradient in fp16 or bf16training? If the optimizer was created with fp16/bf16 parameters and there's no additional logic to store copies of the params, then the optimizer being 2x the size of the params is expected. Also I believe this may be a better question for the huggingface transformers repo https://github.com/huggingface/transformers as it is likely setup related.","Sorry I made a mistake, the 2x size is expected. > then the optimizer being 2x the size of the params is expected. Closing this issue."
