transformer,module 'torch.mps' has no attribute 'device'," 🐛 Describe the bug I'm getting the error `module 'torch.mps' has no attribute 'device'` trying to train a `sentencetransformer model (which uses the huggingface transformers trainer). The error is raised on this line > https://github.com/pytorch/pytorch/blob/7ef7c265d4361691dc4cf54152db083de3215fbf/torch/utils/checkpoint.pyL183 Because the mps model doesn't have a `device()` method https://github.com/pytorch/pytorch/blob/7ef7c265d4361691dc4cf54152db083de3215fbf/torch/mps/__init__.py  Versions Collecting environment information... PyTorch version: 2.3.0 Is debug build: False CUDA used to build PyTorch: None ROCM used to build PyTorch: N/A OS: macOS 14.5 (arm64) GCC version: Could not collect Clang version: 15.0.0 (clang1500.3.9.4) CMake version: Could not collect Libc version: N/A Python version: 3.10.14 (main, May 25 2024, 13:44:20) [Clang 15.0.0 (clang1500.3.9.4)] (64bit runtime) Python platform: macOS14.5arm64arm64bit Is CUDA available: False CUDA runtime version: No CUDA CUDA_MODULE_LOADING set to: N/A GPU models and configuration: No CUDA Nvidia driver version: No CUDA cuDNN version: No CUDA HIP runtime version: N/A MIOpen runtime version: N/A Is XNNPACK available: True CPU: Apple M3 Pro Versions of relevant libraries: [pip3] numpy==1.26.4 [pip3] torch==2.3.0 [conda] Could not collect ",2024-06-01T04:45:18Z,triaged actionable module: mps,open,0,4,https://github.com/pytorch/pytorch/issues/127676,I am getting the same bug under Python 3.13 and OS 14.3.1. I got it under both torch 2.2.2 and torch 2.3.,Hey! I think there are two ways we can go about this one:  Update the mps device_module to add this function to set the current device.  Change the checkpoint code to only call this function if the current device is not the same as the device we want to set (so that device/accelerator that only ever have one device don't need to worry about it). ,"For what it's worth, I only encounter this error when using CachedGISTEmbeddingLoss or CachedMultipleNegativesRankingLoss. The noncached versions of those same loss functions do not create the error.",> Hey! >  > I think there are two ways we can go about this one: >  > * Update the mps device_module to add this function to set the current device. > * Change the checkpoint code to only call this function if the current device is not the same as the device we want to set (so that device/accelerator that only ever have one device don't need to worry about it). I like option 1. We would need this method later for Triton work.. Updating current PR with it. 
transformer,Illegal memory access resulted from pointwise autotuning of a cat-like kernel," 🐛 Describe the bug I ran into this issue when applying torch.compile transformer blocks in torchtitain. When running llama_70b w/ local batch_size=4, both eager mode and torch.compile works. However, when running with batch_size=8, eager works but torch.compile fails with ""illegal memory access"". Originally I thought the issue could be OOM manifest as IMA, but the issue persisted when I lowered the memory usage by reducing the number of layers. I stepped through the generated code, the issue originated from the autotuning a splitcatlike kernel. It is reproducible when isolated (see minified repro).  Error logs   Minified repro  ",2024-05-31T22:41:50Z,triaged oncall: pt2 module: inductor,closed,1,4,https://github.com/pytorch/pytorch/issues/127652,is there an easy way of running the original code ? (maybe just post the fx_graph_runnable from TORCH_COMPILE_DEBUG), that's a great idea. Here it is: ,"computesanitizer shows the following:  ========= Invalid __global__ read of size 16 bytes                                        =========     at triton_+0x5d0 in /tmp/torchinductor_root/ja/cja7fko43klibgjaatfwng6o3zjzzszdenrb2pmxdluy5j7qrote.py:66                                                           =========     by thread (3,0,0) in block (327723,0,0)                                     =========     Address 0x7efda5015830 is out of bounds                                     =========     and is 5553170384 bytes before the nearest allocation at 0x7efef0000000 of  size 939524096 bytes                                                 and the line 66 is:  `66     tmp40 = tl.load(in_ptr0 + ((2642411520) + x0 + (67108864*x1)), tmp39, other=0.0)    .to(tl.float32)`",The issue is that we're using 32 bit indexing but `2642411520` requires 64 bits. I'll look into fix
transformer,[inductor][cpu]abnormal performance improvement and accuracy drop for huggingface suit static/dynamic quantization, 🐛 Describe the bug abnormal performance improvement and accuracy drop for huggingface suit static/dynamic quantization in 20240526 nightly release accuracy drop:   model_name  1.62   f8c4c268da67e9684f3287b7468f36a5a27c6a0b textclassification+bertbasechinese !image textclassification+albertbasev1 !image ee6cb6daa173896f8ea1876266a19775aaa4f610  textclassification+bertbasechinese !image textclassification+albertbasev1 !image  Versions SW info               SW       Branch       Target commit       Refer commit                       Pytorch       nightly       549167f       bca6d8b                 Torchbench       chuanqiw/inductor_quant       ee35d764       ee35d764                 torchaudio       nightly       1980f8a       1980f8a                 torchtext       nightly       b0ebddc       b0ebddc                 torchvision       nightly       d23a6e1       d23a6e1                 torchdata       nightly       11bb5b8       11bb5b8                 dynamo_benchmarks       nightly       nightly       nightly          Repro:  Suspected guilty commit: https://github.com/pytorch/pytorch/commit/ee6cb6daa173896f8ea1876266a19775aaa4f610 textclassification+albertbasev1staticquantaccuracydrop_guilty_commit.log ,2024-05-29T15:06:11Z,high priority triaged oncall: pt2 oncall: cpu inductor,closed,0,0,https://github.com/pytorch/pytorch/issues/127402
transformer,4 GPT2 can't run into `_scaled_dot_product_flash_attention_for_cpu` using AOTI due to export related change in https://github.com/pytorch/pytorch/pull/123732," 🐛 Describe the bug  Description Before https://github.com/pytorch/pytorch/pull/123732, when running with AOTI, the SDPA pattern can be hit and `torch.ops.aten._scaled_dot_product_flash_attention_for_cpu.default` is on the `__post_grad_graphs`. However, after this PR, the below models can't run into SDPA any more when running with AOTI. This has brought performance gap between AOTI (can't hit SDPA anymore) and Inductor (which can hit SDPA). I tried on a recent main branch (669560d51aa1e81ebd09e2aa8288d0d314407d82) and the issue is still there.  Impacted models 2 models in the HF suite (DistillGPT2, GPT2ForSequenceClassification) and 2 models in the torchbench suite (hf_GPT2, hf_GPT2_large) of the dynamo benchmark are impacted.  Steps to reproduce (I didn't turn on freezing since at that moment, freezing can't work due to other issue (fixed by https://github.com/pytorch/pytorch/pull/124350 on recent main). But the graph with or without freezing both have this issue)  In the output log Using commit https://github.com/pytorch/pytorch/commit/02ed2992d94e6bb09d95fb1409883fc61cf19e13, there's `torch.ops.aten.bmm.default` but not `_scaled_dot_product_flash_attention_for_cpu` in the `__post_grad_graphs`. Using commit https://github.com/pytorch/pytorch/commit/4f29103749c5011529f1abb10b1508a682588909 (one commit before the above):  Here're some findings: Using GPT2ForSequenceClassification as an example, I printed the graph before and after https://github.com/pytorch/pytorch/pull/123732 (the graph is dumped before this line of code: link): Before the PR where SDPA can be hit:  After the PR where SDPA can't be hit: There's on extra line **before** ",2024-05-29T07:07:59Z,triaged module: regression oncall: pt2 module: aotinductor module: sdpa,closed,0,5,https://github.com/pytorch/pytorch/issues/127383,, ,Can we solve by adding extra matching patterns?,"w , is this still a problem?",It's not an issue anymore using the latest main. I checked that we have `aoti_torch_cpu__scaled_dot_product_flash_attention_for_cpu` in the output code for the 4 models reported in this issue.
transformer,[Traceable FSDP2] Add Dynamo support for run_with_rng_state HOP,Test command: `pytest rA test/inductor/test_compiled_autograd.py::TestCompiledAutograd::test_trace_run_with_rng_state`   CC([Traceable FSDP2] Add inductor E2E unit test for FSDP2+SAC for transformer model)  CC([Traceable FSDP2] Add Dynamo support for run_with_rng_state HOP)  CC([Traceable FSDP2] Add autofunctionalize support for mutable list[Tensor] (copy from Brian's PR 127347); enable E2E inductor unit test for transformer model) ,2024-05-28T01:59:21Z,Merged ciflow/trunk topic: not user facing module: inductor module: dynamo ciflow/inductor keep-going,closed,0,10,https://github.com/pytorch/pytorch/issues/127247,"How did you get into this situation? I thought the run_with_rng_state HOP is used for the torch.utils.checkpoint x torch.compile design, and should not show up in Dynamo itself?  ","> How did you get into this situation? I thought the run_with_rng_state HOP is used for the torch.utils.checkpoint x torch.compile design, and should not show up in Dynamo itself?   It only appears during Compiled Autograd Dynamo tracing of the AOT bwd graph (which contains the run_with_rng_state HOP)"," merge f ""unrelated failures"""," Merge started Your change will be merged immediately since you used the force (f) flag, **bypassing any CI checks** (ETA: 15 minutes).  Please use `f` as last resort and instead consider `i/ignorecurrent` to continue the merge ignoring current failures.  This will allow currently pending tests to finish and report signal before the merge. Learn more about merging in the wiki. Questions? Feedback? Please reach out to the PyTorch DevX TeamAdvanced Debugging Check the merge workflow status  here ", your PR has been successfully reverted., merge, Merge started Your change will be merged once all checks pass (ETA 04 Hours). Learn more about merging in the wiki. Questions? Feedback? Please reach out to the PyTorch DevX TeamAdvanced Debugging Check the merge workflow status  here ,"The merge job was canceled or timed out. This most often happen if two merge requests were issued for the same PR, or if merge job was waiting for more than 6 hours for tests to finish. In later case, please do not hesitate to reissue the merge command  For more information see pytorchbot wiki."," merge f ""unrelated failures"""," Merge started Your change will be merged immediately since you used the force (f) flag, **bypassing any CI checks** (ETA: 15 minutes).  Please use `f` as last resort and instead consider `i/ignorecurrent` to continue the merge ignoring current failures.  This will allow currently pending tests to finish and report signal before the merge. Learn more about merging in the wiki. Questions? Feedback? Please reach out to the PyTorch DevX TeamAdvanced Debugging Check the merge workflow status  here "
transformer,"When training done, the mode output same result each tensor input. ( I tried many way to debug, but can't find any way to fix it, so i guess this is a bug )"," 🐛 Describe the bug  those code is simple way to show your guys. one, i make sure i am using same dataset to infer. two, my model is LSTM + Transformer encoder, so i made a method to reset cell state in each train and eval. three, i tried make eval to train + no grad to test output, but still 0 chanse is the most ( by the way, the mode is made to output one of 0, 1, 2, 3 ). when i training, with backward and optimizer, the model act normal, out put 1, 2, 0... something like that. but when i not useing grad to output, the model only output me 0, this is really big problems to me. thanks for help 😭  Versions pytorch 2.3.0 Python 3.12.2 cuda 12.1.0",2024-05-25T16:54:17Z,,closed,0,3,https://github.com/pytorch/pytorch/issues/127177,"It's not overfitting, because is same data for infer. It's not different weight, i checked ( save and load ). it's not eval() problem, i already check with train() + no grad.","It is unclear that this is a bug in PyTorch as there are many things that can go wrong to cause a model to not train properly for these types of questions, please check out https://discuss.pytorch.org/.","It's Label leakage by optimizer. my label like 0,0,0,0... 1,1,1,1... 2,2,2,2, so when traning, optimizer tell model 2 is right, so it will contiune output 2, because label is 2,2,2,2,2..... i'm wrong, this not a bug. without optimizer, nobody tell model what label right right now, and 0 is the answer."
transformer,"RuntimeError: ""_amp_foreach_non_finite_check_and_unscale_cuda"" not implemented for 'BFloat16'"," 🐛 Describe the bug i use pytorch==2.3.0 and peft to train llama3 8b , when i run my code, its raise error like:  full of my training code like:  and the all output in terminal like: ```text C:\ProgramData\miniconda3\envs\llama\python.exe D:/codes/llm_about/selfllm/zzzzz_train/llama38B/finetune_llama3_8b.py Special tokens have been added in the vocabulary, make sure the associated word embeddings are finetuned or trained. tokenizer about:   128001 128001 Map: 100% (main, May  6 2024, 19:44:50) [MSC v.1916 64 bit (AMD64)] (64bit runtime) Python platform: Windows1010.0.22631SP0 Is CUDA available: True CUDA runtime version: 12.1.105 CUDA_MODULE_LOADING set to: LAZY GPU models and configuration: GPU 0: NVIDIA GeForce RTX 3090 Nvidia driver version: 555.85 cuDNN version: C:\Program Files\NVIDIA GPU Computing Toolkit\CUDA\v12.1\bin\cudnn_ops64_9.dll HIP runtime version: N/A MIOpen runtime version: N/A Is XNNPACK available: True CPU: Revision= Versions of relevant libraries: [pip3] numpy==1.24.3 [pip3] torch==2.3.0 [pip3] torchaudio==2.3.0 [pip3] torchvision==0.18.0 [conda] blas                      1.0                         mkl    defaults [conda] mkl                       2021.4.0                 pypi_0    pypi [conda] mklservice               2.4.0           py310h2bbff1b_0    defaults [conda] mkl_fft                   1.3.1           py310ha0764ea_0    defaults [conda] mkl_random                1.2.2           py310h4ed8f06_0    defaults [conda] numpy                     1.24.3          py310hdc03b94_0    defaults [conda] numpybase                1.24.3          py310h3caf3d7_0    defaults [conda] pytorch                   2.3.0          ",2024-05-25T16:33:16Z,triaged module: amp (automated mixed precision) module: mta,open,0,3,https://github.com/pytorch/pytorch/issues/127176,this is my cuda cudnn infos: ,some of my dataset like: ,"For BFloat16 AMP, the grad scaler wouldn't be needed as its range is equivalent to fp32's. Could you try the script without grad scaler?"
transformer,Significant peformance regression in DDP for torch > 2.1," 🐛 Describe the bug DDP is significantly slower on torch versions after 2.1.   Requirements  Machine with multiple (4+) GPUs. I am using AWS g5.12xlarge which has 4 x A10G GPUs.  Steps to reproduce  Create two environments.   Create a file called `testddp.py` with the following code (adapted from torch ddp tutorial).   Run using `torchrun`:   Observations  Environment 1 (torch 2.1.x) shows: ~3hr training time.  Environment 2 (torch 2.3.x) shows: ~5hr training time. I had originally observed this issue in `transformers` (see here) but this looks like a torch DDP issue, not really something on `transformers` side. Note: This is also an issue in `torch==2.2.x` but here I am just showing on `torch==2.3.0`.  Expected Result Training time should be the same or at least not significantly worse than <=2.1 on newer torch versions. In my actual codebase, I am seeing up to 2x worse training time on newer torch versions.  Versions  Environment 1 (`torch==2.1.2`)  ",2024-05-24T11:18:09Z,oncall: distributed triaged,closed,11,22,https://github.com/pytorch/pytorch/issues/127077,Something that could help us a lot since you already have envs setup would be to get profiler traces from the two envs to compare. Would you be able to do that and share the traces?," If you could tell me how to do that, I'll be happy to share the traces. ","I think something like the following may work:  This should just take the profiler trace on rank 0 and save it to some `.json` file. If you could share the `.json` file, then that would be great. (We would then view them in something like chrome://tracing/ to compare the difference between the envs.)","Here are the files: torch2.1.json torch2.3.json For completeness, here is the script I ran using `torchrun nprocpernode=4 profileddp.py`:  profileddp.py.txt","Thanks! I wonder if there is a regression in NCCL across the two versions.  torch2.1: allreduces take 1.309 ms and 7.944 ms  torch2.3: allreduces take 1.952 ms and 13.987 ms  Allreduce message sizes are (1054725 * 4) bytes and (7347200 * 4) bytes, respectively For torch2.1, this equates to roughly  2 * (1054725 * 4 bytes) / (0.001309 seconds) / 1e9 = 6.446 GB/s bandwidth  2 * (7347200 * 4 bytes) / (0.007944 seconds) / 1e9 = 7.399 GB/s bandwidth where the factor of 2 is from allreduce requiring two passes around the ring. More precisely, there could be an `N1/N` factor for `N=4` GPUs, but it does not matter that much. The point is that, the achieved bandwidth on these collectives is pretty low. I am not as familiar with this part, but I think that it is possible to use https://github.com/NVIDIA/nccltests to test what kind of allreduce bandwidth you should expect to see for your hardware setup. In short, the current evidence points toward there being a NCCL regression in the allreduce times for your model/setup, and your training is communication bound. This translates to slowdown in endtoend training time. cc:   if you guys have any suggestions on how to further diagnose this"," Since this might be a NCCL regression, I wonder if we can try to do the following: 1. Get the NCCL versions for both envs, e.g. via `python c ""import torch;print(torch.cuda.nccl.version())""` 2. Run a script that only does allreduce Example with profiler:  Example with CUDA events for timing without profiler:  The latter might be simpler since then we do not need to manually inspect the profiles."," torch 2.1 NCCL version: (2, 18, 1)   torch 2.2 NCCL version: (2, 19, 3)   torch 2.3 NCCL verison: (2, 20, 5)  Code: ","Regarding the micro benchmark, since you are calling `torch.cuda.Event()` and `torch.cuda.synchronize()`, the program must know which device to perform these operations on. Otherwise, these two operations would be performed on device 0 (the default one in CUDA's view). Obviously, the non0 ranks do not have CUDA kernels on device 0. So they record almost 0 time. You just need to add a line here:  Then you would see roughly equal time:  (I measure the time on a different hardware platform, so don't take the absolute number seriously.)","And also regarding NCCL perf of different versions, I did some micro benchmarks too using https://github.com/NVIDIA/nccltests.  There seems to be no difference across versions, with the sizes you provided.  See https://gist.github.com/kwen2501/89c28b6d12045b45ccf7e33816af2713. But I was testing them on 4 x A100 with NVLinks, instead of 4 x A10g, which does not rule out the chance of a platformspecific issue. That said, another possibility may be that the regression comes from torch side.","Sure, here's the result:  torch 2.1   torch 2.3 ",Thanks! Are you familiar with running nccltests? Can you run it with NCCL 2.18.5 and 2.20.5 on your platform? Thanks!,Let me type the commands here:  You can do the above separately with `v2.18.51` and `v2.20.51` for the  `` field.,"Sorry, I may have messed up my environments in the last couple of tests. Need to take a break now. Will post an update tomorrow. ","I ran some more tests.   On AWS p4d.24xlarge (8 x A100)  `torch==2.3.0 transformers==4.30.2 accelerate==0.20.3`  `testddp.py` script in the first comment: ~50min.  Minimal script in this issue: ~41hrs.  My own training script: ~8.5hrs.  `torch==2.3.0 transformers==4.40.2 accelerate==0.30.1`  `testddp.py` script in the first comment: ~50min  Minimal script in this issue: ~41hrs.  My own training script: ~13hrs.  `torch==2.0.1 transformers==4.30.2 accelerate==0.20.3`  `testddp.py` script in the first comment: ~50min  Minimal script in this issue: ~41hrs.  My own training script: ~8.5hrs.  `torch==2.1.2 transformers==4.30.2 accelerate==0.20.3`  `testddp.py` script in the first comment: ~50min  Minimal script in this issue: ~41hrs.  My own training script: ~8.5hrs. Something is off with the second env but I am not really sure if this is a torch or transformers issue.   On AWS g5.48xlarge (8 x A10G) This is a different machine than the previous one with 4 x A10Gs. Here, something is clearly going wrong with torch.  `torch==2.3.0`  `testddp.py` script in the first comment: ~16h  allreduce test:   `torch==2.0.1`  `testddp.py` script in the first comment: ~7h  allreduce test: ",Thanks for the updates.  I think it would be helpful to focus on the clearer case for now  the A10g platform. Do you mind running the nccltests on this machine? That would help isolate torch vs NCCL. Thanks.,I am trying that and running into some errors at step `make j NCCL_HOME=../nccl/build` ,"Nevermind, I fixed the issue by symlinking to `/usr/lib/libnccl.so`.  v2.18.51   v2.20.51 ",This machine actually has 8 A10Gs:  v2.18.51   v2.20.51  Weird that bandwidth is similar when testing with 4 GPUs but worse in 2.20.5 with 8 GPUs. 🤔 ,"Interesting.  If you'd like further support, you can open an issue in NCCL and link to the above A10g results.  It would be also helpful for them to know the topology of your machine:  Cc NCCL experts:   ","Indeed, I'm not sure why that is. Can you open an issue on the NCCL project (https://github.com/nvidia/nccl)? Please attach the log of a run with 2.18 and 2.20, running with the following environment variables set: `NCCL_DEBUG=INFO NCCL_DEBUG_SUBSYS=INIT,ENV,GRAPH` Thanks!",Thanks! Opened an issue: https://github.com/NVIDIA/nccl/issues/1298,"Given the discussion in https://github.com/NVIDIA/nccl/issues/1298, I think we can close the PyTorch issue, as the root cause is more related to NCCL and the specific user hardware setup. Feel free to reopen if there are any followups."
transformer,Torchscript export of `Salesforce/blip2-opt-2.7b` model fails with Conv shape error, 🐛 Describe the bug Export of `Salesforce/blip2opt2.7b` with the torchscript exporter fails with conv shape error:  Here's the export script I used:  Note that the same model can export successfully with dynamo exporter (by setting `dynamo_export = True` in the script.  Versions I'm using the NGC pytorch container `nvcr.io/nvidia/pytorch:24.04py3` ,2024-05-22T03:16:45Z,oncall: jit,open,0,1,https://github.com/pytorch/pytorch/issues/126843,cc: nvidia
transformer,Torchscript export of some HF models fails with indexing errors on `past_key_values`," 🐛 Describe the bug Running the following export script for the two falcon models `tiiuae/falconrw1b` and `tiiuae/falcon7b` runs into indexing errors related to `past_key_values`:  The error is:  The same model can be exported with the dynamo exporter, by setting `dynamo_export = True` in the script.  Versions I'm using the NGC pytorch  container `nvcr.io/nvidia/pytorch:24.04py3` ",2024-05-22T03:07:04Z,,closed,0,3,https://github.com/pytorch/pytorch/issues/126840,"Similar errors on `past_key_values` are also occurring for `EleutherAI/gptj6b`, `Qwen/Qwen7BChat`, `distilbert/distilgpt2`, `bigscience/bloom560m`",cc: nvidia,Closing this bug as this error can be resolved by passing in the input data differently: 
transformer,FakeTensor `forward()` on `bert` attention when using FakeTensor returns a DataDependentOutputException," 🐛 Describe the bug I attempted to run the How to measure memory usage from your model without running it? code, simply replacing the model with a very basic one from Hugging Face (`bertbaseuncased`), and I was left with a `torch._subclasses.fake_tensor.DataDependentOutputException: aten._local_scalar_dense.default`.  Some advice on how to move past this would be great, as ideally I'd like to merge this functionality in with the HF model memory estimator tool once it's stable/agnostic enough if possible! Full example:     Versions Collecting environment information... PyTorch version: 2.3.0+cu121 Is debug build: False CUDA used to build PyTorch: 12.1 ROCM used to build PyTorch: N/A OS: Ubuntu 22.04.3 LTS (x86_64) GCC version: (Ubuntu 11.4.01ubuntu1~22.04) 11.4.0 Clang version: Could not collect CMake version: version 3.27.0 Libc version: glibc2.35 Python version: 3.9.15 (main, Nov 24 2022, 14:31:59)  [GCC 11.2.0] (64bit runtime) Python platform: Linux6.5.035genericx86_64withglibc2.35 Is CUDA available: True CUDA runtime version: 11.5.119 CUDA_MODULE_LOADING set to: LAZY GPU models and configuration: GPU 0: NVIDIA GeForce RTX 3070 Laptop GPU Nvidia driver version: 535.171.04 cuDNN version: /usr/lib/x86_64linuxgnu/libcudnn.so.7.6.5 HIP runtime version: N/A MIOpen runtime version: N/A Is XNNPACK available: True CPU: Architecture:                       x86_64 CPU opmode(s):                     32bit, 64bit Address sizes:                      39 bits physical, 48 bits virtual Byte Order:                         Little Endian CPU(s):                             16 Online CPU(s) list:                015 Vendor ID:                          Genui",2024-05-21T00:55:23Z,triaged tensor subclass module: fakeTensor module: dynamic shapes,open,0,1,https://github.com/pytorch/pytorch/issues/126738,You could try enabling this by passing in a shape env to the fake tensor constructor but I'm... not that optimistic lol
